vettingID,ccode_cow,invalid,alterationOf,policyName,dateLaw,narrative,yearStart,yearEnd,policySource,enactment,implemented,implementationNotes,courtChallenge,numberInvestigated,sources,startedDemocraticTransition,fitsPostAutocraticTJ,startedIntraConflBefore,fitsConflictTJ,beganDuringIntraConfl,beganAfterIntraConfl,type_dismissal,type_ban,type_declassification,type_perjury,policy_type,grp_exe,grp_legis,grp_judiciary,grp_public,grp_police,grp_military,grp_parties,grp_other,groups_targeted,inst_exe,inst_legis,inst_judiciary,inst_public,inst_police,inst_military,inst_parties,inst_other,inst_targeted,sum_inst,ban_from_elected,implementation,fairness,hearingsPublic,appealJudgment,var_fairness,policyName_fr,ucdpConflictID,ucdpDyadID,targetingWhy,policyProcedure,targetingAffiliationRank,targetingPositionSought,targetingAffiliation,targetingPositionsRank,sanctions,country,tjet_version
78,367,0,,Citizenship Law,1994,"Latvia’s Citizenship Law (1994) discriminated against non-Latvians in terms of citizenship rights and also limited the ability of non-Latvians to participate in political life. There were explicit lustration-type limitations on naturalization, forbidding the naturalization of individuals who propagated communist ideas, or “have been employees, informers, agents, or safe house keepers of the U.S.S.R. (L.S.S.R. [Latvian Soviet Socialist Republic]) KGB, or of the security service, intelligence service or other special service of some other foreign state”. (Horne, Ch. 2) This law enabled only certain age groups to be naturalized every year. Latvian authorities wanted to temporarily exclude Soviet migrants, effectively creating a vetting process as only citizens could hold certain positions in government, the armed forces, and foreign service/intelligence. Because many former USSR agents were employed in these positions at the time of the passage of this law, it effectively required their removal.",1994,2002,Legislature/Parliament,legislative act,Yes (fully or partially),,court challenge modified the policy,,"""Wezel, Katja. """"Latvia."""" Encyclopedia of Transitional Justice. Ed. Lavinia Stan and Nadya Nedelsky. New York: Cambridge University Press, 2013. 273-279. Print.""",1,1,0,0,0,0,1,1,0,0,2,,,,,,,,1,1,1,1,1,1,1,1,,,3,6,1,1,"One source describes two “non-democratic transitional justice elements” in Latvia. First, lustration was politicised and used as a political tool against ‘others. Russian minorities, even their descendants, have been unjustly punished by the tyranny of the majority. Second, there was a distrust of the democratisation by the Latvian intelligentsia. (Sairamby, pp. 136-137.)",don't know,don't know,1,Droit de la citoyenneté,,,membership or affiliation with a certain group or organization,legislation,low; high,"public sector employee (bureaucrats, low-rank nominated or elected officials); police (includes ordinary police and secret police informants); legislature; executive; judiciary; armed forces",other,high,dismissal from current employment; ban from future employment,Latvia,2024-08-20
112,350,0,,"Vetting of academics: Constitutional Act of September 3, 1974 & Presidential Decree 652/1974 & Legislative Decree 88/1974",,"The unelected transitional government issued three acts relevant to vetting of academics, which itself was part of a wider ""dejuntafication"" campaign (Sotiropoulos 2007, 125). The Constitutional Act of September 3, 1974 called for the rehiring of professors dismissed by the junta and for the establishment of the Special Disciplinary Council (SDC) to vet certain categories of academics and set criteria for academic vetting. According to the September 3 Act, professors could be vetted if they 1) were appointed by the junta to a public sector post between 1967 and 1974, 2) had sided with the junta inside the university system (e.g. by denouncing left-wing students or sitting on junta-staffed bodies), 3) had been appointed/elected to university posts previously held by junta-purged academics, or 4) were lower-level professors hired after 1967 (Sotiropoulos 2007, 134-35). Presidential Decree 652/1974 appointed the nine members of the SDC. Legislative Decree 88/1974 reversed certain provisions of the September 3 Act so that academics could only be vetted if they were shown to be active supporters of the junta, not simply if they were appointed by the junta.",1974,,,constitutional act,Yes (fully or partially),,don't know,,"Sotiropoulos, Dimitri A. ""Swift Gradualism and Variable Outcomes: Vetting in Post-Authoritarian Greece."" Justice as Prevention: Vetting Public Employees in Transitional Societies. Eds. Alexander Mayer-Rieckh and Pablo De Grieff. New York: Social Science Research Council, 2007. 120-145.",0,0,0,0,0,0,0,0,0,0,,,,,,,,,,,,,,,,,,,0,0,,,,,,,"Vérification des antécédents des universitaires : Loi constitutionnelle du 3 septembre 1974, décret présidentiel 652/1974 et décret législatif 88/1974.",,,membership or affiliation with a certain group or organization,,,other,other,,dismissal from current employment; ban from future employment,Greece,2024-08-20
177,367,0,,"Election Law on Cities and Town Councils, District Councils and Pagasts Councils",1994-01-24,"Banned former Soviet secret agents and members of the Communist Party from running in state and local elections In 1995, the Saeima (the Latvian Parliament) enacted a law banning several groups from being candidates for public office. Sources mention both local government posts (Stan 2009, 252) and national-level parliamentary elections. Lustration is carried out by the Central Election Commission (ODIHR 2007, 4-6). The European Office for Democratic Institutions and Human Rights documents some cases in which the lustration laws have been used to prevent individuals from being candidates. There is little evidence to elaborate more broadly on the law's implementation. In 2004, its mandate was extended for ten years and it remained in force as at 2017 (ODIHR 2007, 5-6). The law faced several challenges between 1998 and 2006, and was upheld each time (Stan 2009). In the 2006 case, the court ruled that lustration would remain in effect but exempted an individual challenger on the basis of his ""noteworthy contribution to … democratic values."" There is no evidence of an appeals process, although the 2006 decision suggests that individuals may be able to avoid lustration provisions by bringing individual action to court (ODIHR 2007, 5-6).",1995,,Legislature/Parliament,legislative act,Yes (fully or partially),,court challenge did not modify the policy,,"""Republic of Latvia: Parliamentary Elections (7 October 2006): OSCE/ODIHR Limited Election Observation Mission Final Report."" Office for Democratic Institutions and Human Rights (ODIHR). 2007. <http://www.osce.org/odihr/elections/latvia/23954> Stan, Lavinia. ""Conclusion: Explaining Country Differences."" Transitional Justice in Eastern Europe and the Former Soviet Union: Reckoning with the Communist Past.” Ed. Stan. New York: Routledge, 2009. 245-270. Print. ""Building Trust and Democracy: Transitional Justice in Post-Communist Countries"", Cynthia M. Horne, Chapter 2",1,0,0,0,0,0,0,1,0,0,1,,,,,1,,1,,2,,1,1,1,,,,,2,3,1,1,"Several high profile cases of appeals of the lustration decision banning litigant from running for elected office and challenging the public disclosure of information (Stan 2009, 234). In at least one case, where the Latvian Supreme Court upheld the decision, the litigant then appealed to the ECtHR to reconsider the legality of sections 5(6) of the Elections Law. (Horne, Ch 2)",public,yes,3,"Loi électorale sur les conseils municipaux, les conseils de district et les conseils de pagodes",,,membership or affiliation with a certain group or organization,legislation,low; high,"public sector employee (bureaucrats, low-rank nominated or elected officials); legislature; judiciary",political parties; police (includes ordinary police and secret police informants),low; high,ban from future employment,Latvia,2024-08-20
165,360,0,66,Governmental Emergency Ordinance 24,2008-03-05,"""reaffirmed the CNSAS as the state agency responsible for verifying the collaboration with the Securitate of individuals elected or appointed to certain public positions"" (Montero 2010, 229)",2008,,,executive decree,Yes (fully or partially),"CNSAS could not determine collaboration, only courts could do this based on CNSAS investigation. Still active in 2016 and 2018",no court challenge,"~53,000 by end of 2012",Montero 2010; Ciobanu 2014; Horne 2017 ch3,1,1,1,0,0,0,0,0,1,0,1,,,,,1,,,,1,1,1,1,1,1,1,,,3,6,0,1,,public,don't know,2,Ordonnance gouvernementale d'urgence 24,,,specific individual conduct; membership or affiliation with a certain group or organization,,low; high,"public sector employee (bureaucrats, low-rank nominated or elected officials); police (includes ordinary police and secret police informants); legislature; executive; judiciary; armed forces",police (includes ordinary police and secret police informants),low; high,declassification,Romania,2024-08-20
137,366,0,,"Law on the procedure for taking the oath, written oath of conscience (süümevanne) for civil service positions (1992)",1992-08-07,"Estonia incorporated mandatory lustration measures into their Constitution. The Constitution of the Republic of Estonia Implementation Act (1992) stipulated a special “written oath of conscience” (süümevanne) requirement for all civil service positions and elected public offices at the local and national level (sections 6 and 7). Further details were provided in the Law on the procedure for taking the oath, written oath of conscience (süümevanne) for civil service positions (1992) and Amendments to the Oath of Conscience Submission Act (1994). The oath was required because records of the security services were returned to Russia, destroyed or otherwise unavailable. The oath of conscience required individuals to disavow participation in past repression, namely assert that he/she did not work for and was not complicit with either the Komitet gosudarstvennoy bezopasnosti (KGB) or the Nazi security services. The oath applied to both new officials and those in offices when the oath was codified. If a person was complicit with the state security organs, or military intelligence or counterintelligence services, or was a collaborator with these services, or was involved in the surveillance or repression of fellow citizens, then he/she was not eligible for public employment.",1992,1994,Legislature/Parliament,constitutional act,Yes (fully or partially),"Constitution Implementation Act stipulated requirement to remain in force for a total of nine years until December 31, 2000.",challenged in court with unclear outcome,thousands of individuals submitted oaths of conscience,"""Building Trust and Democracy: Transitional Justice in Post-Communist Countries"", Cynthia M. Horne, Chapter 2",0,0,0,0,0,0,0,1,0,1,2,,,,,1,1,,,2,,,,1,,,,,1,1,0,1,"The State could challenge contested oaths, made by individuals, in the court system with some early confusion over which courts even had jurisdiction to hear complaints about the veracity of oaths, later clarified in the 1994 Amendment to the Oath (Pettai and Pettai 2014, 135). There were a number of high-profile cases in which oaths of conscience were contested, but in the end there was only one conviction of a “lustration liar” before the measures expired (Pettai 2013, 164; Pettai and Pettai 2014, 137).",don't know,don't know,1,"Loi sur la procédure de prestation de serment, serment de conscience écrit (süümevanne) pour les postes de la fonction publique (1992)",,,membership or affiliation with a certain group or organization,legislation,low; high,"public sector employee (bureaucrats, low-rank nominated or elected officials)",police (includes ordinary police and secret police informants); armed forces,low; high,ban from future employment; dismissal and ban upon lustration lie,Estonia,2024-08-20
41,310,0,40,Declassification law based on draft T/541 [Act 3/2003?],2002-12-23,"This file access law was passed by the Hungarian Parliament on December 23, 2002 and was based on draft T/54 (Barrett et al 2007, 272)(enacted as Act 3/2003, based on Encyclopaedia, Vol 2) According to Barrett et al, this law ""represents a significant shift in policy"" in that it ""provides for the disclosure of information rather than just the avoidable threat of disclosure"" (273). The 1994 Act XXIII (see entry, above) had provided for the avoidable threat of disclosure and had operated through lustration commissions. The 2002 law granted citizens the right to request files (collected by the former secret service) of anyone currently or previously holding public office. Furthermore, ""some very limited information found in the Archive about an individual's relationship to any of the security service directorates (not just III/III) can be published"" (Barrett et al 2007, 273-74). The 1994 Act only applied to III/III. The 2002 law granted citizens access to the secret files of those holding ""public office"" and allowed for certain information found in these files to be published. ""Public office"" was not clearly defined but is typically ""taken to include positions"" in the executive or in the media (Barrett et al 273-74). I do not have data on challenges or implementation of this law.",2002,2005,Legislature/Parliament,legislative act,Yes (fully or partially),,,"17,000","Barrett, Elizabeth, Peter Hack, and Agnes Munkacsi. ""Lustration as Political Competition: Vetting in Hungary."" Justice as Prevention: Vetting Public Employees in Transitional Societies. Ed. Alexander Mayer-Rieckh and Pablo de Greiff. New York: Social Science Research Council, 2007. 260-307. Ellis, Mark S. ""Purging the Past: The Current State of Lustration Laws in the Former Communist Bloc."" Law and Contemporary Problems, 59.4 (1996): 181-196. Fithen, Caspar. 2009. ""The Legacy of Four Vetting Programs: An Empirical Review,"" Security System Reform Program, International Center for Transitional Justice. Halmai, Gabor and Kim Lane Scheppele. ""Living Well is the Best Revenge: The Hungarian Approach to the Past."" Transitional Justice and the Rule of Law in New Democracies. Ed. A. James McAdams. Notre Dame: University of Notre Dame, 2001. 155-182.",1,0,0,0,0,0,0,0,1,0,1,1,,,,,,1,1,3,1,1,1,1,,,,1,2,5,0,1,"Horne (2017) says: There was political instrumentalization of the laws by political parties to secure votes, and critics charged these 2000 and 2003 amendments were simply politically motivated attempts to discredit or disadvantage the opposition by the dominant political party (Kiss 2006; Tomiuc 2002). A series of political scandals, information problems, political intrigues and accusations, media leaks of confidential information, and manipulation by political parties all contributed to the perception that lustration was “running politically amok and trampling on people’s dignity and solid reputations” (RFE/RL 2002, 30 August).",don't know,,0,Loi de déclassification basée sur le projet T/541 [loi 3/2003].,,,membership or affiliation with a certain group or organization,legislation,low; high,"public sector employee (bureaucrats, low-rank nominated or elected officials); political parties; legislature; executive; judiciary; other",executive; other,high,declassification,Hungary,2024-08-20
67,360,0,,2010 Lustration Law,2010-05-19,"The Lustration Law was enacted by the Romanian Parliament May 19th, 2010 (""The Lustration law, unconstitutional: Collective sentences are forbidden."" Gandul, 2010). This law proposed to ban former senior level communist dignitaries, public servants, chiefs and deputy chiefs of police departments and commanders of political detention centers from running for public office for five years (Ciocoui, 2010). June 7th 2010, the Constitutional Court of Romania deemed this law unconstitutional, because it stipulated collective guilt and was enacted decades after the collapse of the previous regime. (""The Lustration law, unconstitutional: Collective sentences are forbidden."" Gandul, 2010). This policy no longer has any legal standing.",2010,2010,Legislature/Parliament,legislative act,No,,court challenge ended the policy,,"Ciocoiu, Paul. ""Romania gets lustration law, 20 years late."" SETimes.com. 1 June 2010. 22 June 2013 <http://www.setimes.com/cocoon/setimes/xhtml/en_GB/features/setimes/features/2010/06/01/feature-02>. ""Court Throws Out Lustration."" Presseurop. 8 June 2010. 22 June 2013 <http://www.presseurop.eu/en/content/news-brief/269151-court-throws- out-lustration-law>. Horne, Cynthia. ""Assessing the Impact of Lustration on Trust in Public Institutions and National Government in Central and Eastern Europe."" Comparative Political Studies 412-446 45 (2011): 421. <http://cps.sagepub.com/content/45/4/412.short>. Mica, Adriana.""Forgiveness and Disclosure Scandals in Romania."" Inter- Disciplinary.net. First Global Conference (2008). Session 5b: Forgiveness and Political Violence, Salzburg, Austria, Friday 7th March – Sunday 9th March 2008 Internet. 6/22/13. ""The Lustration law, unconstitutional: Collective sentences are forbidden."" Gandul.info. 8 June 2010. 22 June 2013 <http://www.gandul.info//english/the-lustration-law-unconstitutional-collective-sentences-are-forbidden-6326431>. ""Romanian law banning ex-communist officials from office unconstitutional."" BBC Monitoring Europe, 21 June 2010. LexisNexis Academic. 22 June 2013 ""Romanian parliament approves board set up to examine secret police archives."" BBC Monitoring Europe, 8 Mar. 2000. LexisNexis Academic. 22 June 2013 ""Romanian vetting body finds premier no Securitate collaborator."" BBC Monitoring Europe, 5 June 2006. LexisNexis Academic. 22 June 2013 Stan, Lavinia and Nadya Nedelsky. Encyclopedia of Transitional Justice Volume 2. New York: Cambridge University Press, 2013. Print. Stan, Lavinia. Transitional justice in Eastern Europe and the former Soviet Union: Reckoning with the Communist past. London: Routledge, 2008. Stan, Lavinia. Transitional Justice in Post-communist Romania: The Politics of Memory. Cambridge: Cambridge UP, 2013. Print.",1,1,1,0,0,0,0,1,0,0,1,1,,,1,1,,1,,3,,,,,,,,,0,0,0,0,,don't know,don't know,1,Loi de lustration 2010,,,membership or affiliation with a certain group or organization,legislation,high,,"public sector employee (bureaucrats, low-rank nominated or elected officials); political parties; police (includes ordinary police and secret police informants); executive",,ban from future employment,Romania,2024-08-20
84,620,0,,Political Isolation Law of 2013,,This law excluded all Gaddafi officials from government for 10 years.,2013,2014,Legislature/Parliament,legislative act,Yes (fully or partially),,challenged in court with unclear outcome,,"Popken, B. (2020). Vetting the public sector. In P.R. Williams & M. Sterio (Eds.), Research Handbook on Post-Conflict State Building. Elgar Online. ""David, R. and Mzioudet, H. (2014). Personnel change or personal change? Rethinking Libya's Political Isolation Law. Brookings Doha Center - Stanford University Project on Arab Transitions."" Libya parliament revokes 'political isolation' law. (2014, February 2). Anadolu Agency. Kersten, M. (2014). Libya's Political Isolation Law: Politics and Justice or the Politics of Justice? Middle East Institute.",0,0,1,0,0,0,0,0,0,0,,,,,,,,,,,,,,,,,,,0,0,,,,don't know,don't know,,Loi sur l'isolement politique de 2013,,,specific individual conduct; membership or affiliation with a certain group or organization,legislation,low; high,"public sector employee (bureaucrats, low-rank nominated or elected officials); police (includes ordinary police and secret police informants); legislature; executive; judiciary; armed forces","public sector employee (bureaucrats, low-rank nominated or elected officials); police (includes ordinary police and secret police informants); legislature; executive; judiciary; armed forces",low; high,dismissal from current employment; ban from future employment,Libya,2024-08-20
173,369,0,,Law On Restoring Trust in the Judicial System,2014-04-8,"The Lustration of Judges Law aimed at reviving the judiciary's credibility by conducting special screening of judges involved in rendering court decisions that encroached on the rights of Euromaidan demonstrators. For this, a Temporary Special Commission under the auspices of the High Council of Justice was established to run the special screening and issue conclusions on whether the actions of a particular judge constitute violations of their oath, disciplinary or criminal offenses. If the violations are found, the conclusion is sent to a responsible body to decide on the judge’s potential dismissal (the High Council of Justice for a violation of the oath; the High Council of Justice or the High Qualification Commission of Judges for a disciplinary offense; and the Prosecutor General Office for criminal offenses). The judges can challenge their dismissal in court. The process is individualized and concerns each judge's potentially unlawful individual conduct. In addition to the special screening, “final and transitional” provisions of the Lustration of Judges Law encompassed the blanket dismissal of all court chairs, ensuring fair electability of such positions by the judges of each court by secret ballot (many of those chairs were reelected) and the premature dismissal of the High Council of Justice and the High Qualification Commission of Judges members. Only around 50 judges were reportedly dismissed because of the lustration processes as of 2019. The lustration process in respect of judges is often criticized for its ineffectiveness and problems with transparency.",2014,,Legislature/Parliament,legislative act,Yes (fully or partially),,court challenge did not modify the policy,8000,Popova 2020; Horne 2018; David 2018,1,0,1,0,0,0,1,0,0,0,1,,,1,,,,,,1,,,1,,,,,,1,1,0,1,The lustration process in respect of judges is often criticized for its ineffectiveness and problems with transparency.,public,yes,3,Loi sur le rétablissement de la confiance dans le système judiciaire,,,specific individual conduct,legislation,high,judiciary,judiciary,high,dismissal from current employment,Ukraine,2024-08-20
77,700,0,,vetting of provincial chiefs of police,,The vetting of provincial chiefs of police in Afghanistan has included vetting on the grounds of the candidate's human rights record.,2001,,,unknown,Yes (fully or partially),,don't know,,"""Kouvo, Sari. """"Afghanistan."""" Encyclopedia of Transitional Justice. Ed. Lavinia Stan and Nadya Nedelsky. New York: Cambridge University Press, 2013. 1-7. Print.""",0,0,1,1,1,0,0,0,0,0,,,,,,,,,,,,,,,,,,,0,0,,,,,,,contrôle des chefs de police provinciaux,333,736,specific individual conduct,,,police (includes ordinary police and secret police informants),,low,,Afghanistan,2024-08-20
