amnestyID,ccode_cow,mechanismDescription,amnestyName,amnestyYear,start_date,narrative,otherExplain,selfAmnesty,qualifyingProcess,blanket,hrCrimes,SGBV,startedDemocraticTransitionBefore,fitsPostAutocraticTJ,startedIntraConflbefore,fitsConflictTJ,pcj,dcj,peaceSettlement,mediation,mechanismDescription_fr,whatCrimes,oppRank,whoWasAmnestied,stateAgents,enactedHow,ucdpConflictID,ucdpDyadID,country,tjet_version
36,350,"President Gizikis decreed a blanket amnesty for state agents and opponents for all political crimes committed prior to June 26, 1974",Presidential Decree 519,1974,1974-07-26,"Presidential Decree 519, Government Gazette, A211 was a President decree implemented on July 26, 1974. Although the amnesty did not garner much publicity, it was at the heart of an intense debate about Karamanlis’ government—the new government’s right to prosecute those associated with the past regime. The amnesty pardons all criminal actions related to the “State of Siege” until the date of the amnesty law’s publication. Those who are imprisoned for these crimes are to be released from prison. The legislation gave the Athens Court of Appeal with the power to investigate, charge, and adjudicate cases against the leaders of the rebellion. The amnesty does not clearly state whether it also excuses acts taken by those most responsible and secondary leaders of the dictatorship for the 1976 coup d’état. Furthermore, its exclusion clause states: “'Those chiefly responsible for political crimes and related preparations, which were directed against the constitutional order resulting from the Constitution of 1 January 1952 and directed at the establishment of the regime of 21 April 1967 which, in the meaning of the Presidential Decree (PD 519/1974), are certainly not included in the amnesty proclaimed by this decree.”",,0,,0,human rights crimes were included in amnesty,0,1,1,1,0,0,0,0,0,Le président Gizikis a décrété une amnistie générale pour les agents de l'État et les opposants pour tous les crimes politiques commis avant le 26 juin 1974.,human rights violations; armed opposition,not specified,state agents; armed opposition,not specified,executive,,,Greece,2024-12-15
434,411,Law No. 2/92 provided amnesty to all Guineans for political crimes and human rights violations,,1992,1992-01-07,,,0,,0,human rights crimes were included in amnesty,0,0,0,0,0,0,0,0,0,La loi n° 2/92 amnistie tous les Guinéens pour les crimes politiques et les violations des droits de la personne.,human rights violations; dissent / political crimes,rank and file,state agents; protesters / political prisoners; armed opposition; refugees / exiles,not specified,legislative act,,,Equatorial Guinea,2024-12-15
935,345,"(Serbia and Montenegro) The ""Demilitarization Agreement"" declares amnesty for ethnic Albanian insurgents who took up arms against Serbian troops, fighting to join an area in southern Serbia - known as Presevo Valley - to neighboring Kosovo, a province administered by NATO.",,2002,2002-07-04,,,0,,0,human rights crimes were included in amnesty,0,0,0,1,0,0,0,0,0,"(Serbie et Monténégro) L'""accord de démilitarisation"" déclare l'amnistie pour les insurgés albanais qui ont pris les armes contre les troupes serbes, luttant pour rattacher une région du sud de la Serbie - connue sous le nom de vallée de Presevo - au Kosovo voisin, une province administrée par l'OTAN.",human rights violations; dissent / political crimes; terrorism; armed opposition,not specified,armed opposition,,legislative act,,,Serbia,2024-12-15
435,950,"The ""Immunity Decree"" (Decree No. 18) provided amnesty to George Speight and other members of the Counter Revolutionary Warfare Unit for all offences related to the May 19 coup and subsequent hostage-taking until July 13, 2000",,2000,2000-07-13,,,0,"The hostages must be released on 13 Jul 2000 and Speight and his followers must disarm. It is a condition of the grant of immunity under the Decree that: (a) political hostages held at the Parliamentary Complex be released on the date of the BLV meeting (b) Service personnel involved in the political takeover, are to be reinstated to their respective service status quo before 19 May 2000 and the return of arms, ordinance and stores to the RFMF",0,human rights crimes were excluded from amnesty,0,1,0,0,0,0,0,1,0,"Le ""décret d'immunité"" (décret n° 18) amnistie George Speight et d'autres membres de l'unité de guerre contre-révolutionnaire pour toutes les infractions liées au coup d'État du 19 mai et à la prise d'otages qui a suivi, jusqu'au 13 juillet 2000.",human rights violations; dissent / political crimes; armed opposition,not specified,armed opposition,,executive,,,Fiji,2024-12-15
610,100,"The government passed an amnesty for guerrillas accused of disturbance and rebellion, but excluding serious crimes of kidnapping and murder",,1985,1985-05-26,,,0,,0,human rights crimes were excluded from amnesty,0,0,0,1,1,0,1,0,0,"Le gouvernement adopte une amnistie pour les guérilleros accusés de troubles et de rébellion, mais excluant les crimes graves d'enlèvement et de meurtre.",dissent / political crimes; armed opposition,rank and file,armed opposition,,legislative act,289,623,Colombia,2024-12-15
191,372,"The ""State Council Manifesto on National Reconciliation"" provided amnesty to political prisoners who took illegal action against the state, including those who attempted a coup in June 1992",,1992,1992-08-03,,,0,,0,human rights crimes were excluded from amnesty,0,0,0,1,1,0,1,0,0,"Le ""Manifeste du Conseil d'État sur la réconciliation nationale"" prévoit l'amnistie des prisonniers politiques qui ont mené des actions illégales contre l'État, y compris ceux qui ont tenté un coup d'État en juin 1992.",dissent / political crimes; armed opposition,rank and file; leaders,armed opposition,,executive,380,813,Georgia,2024-12-15
89,373,"President Ilham Aliev decreed an amnesty for 175 prisoners for various crimes, including a coup attempt against President Heydar Aliyev",,2003,2003-12-29,,political prisoners and convicts,0,,0,human rights crimes are not relevant to this amnesty,0,1,0,1,1,1,0,0,0,"Le président Ilham Aliev a décrété une amnistie pour 175 prisonniers ayant commis divers crimes, notamment une tentative de coup d'État contre le président Heydar Aliyev.",dissent / political crimes; armed opposition,rank and file,protesters / political prisoners; armed opposition,,executive,396,845,Azerbaijan,2024-12-15
1025,702,Amnesty law grants amnesty to persons who commit crimes or acts committed in armed conflicts between 27 March and 25 November 1992,,1996,1996-02-07,,,0,"Persons who have committed crimes in armed conflicts in the periods specified in Article 1 of this Law, committed crimes by stealing, stealing, or carrying out of vehicles, provided that by the law enforcement agencies to the owners of the property the return of property from criminal liability until December 31, 1992 to be done.",0,human rights crimes are not relevant to this amnesty,0,0,0,1,1,1,0,0,0,La loi d'amnistie accorde l'amnistie aux personnes qui ont commis des crimes ou des actes dans le cadre de conflits armés entre le 27 mars et le 25 novembre 1992.,armed opposition,not specified,armed opposition,,legislative act,395,842; 12298,Tajikistan,2024-12-15
254,432,The government granted an amnesty to General Amadou Toumani Touré,General Amadou Toumani Toure Pardon,1992,1992-08-01,,,0,,0,human rights crimes were included in amnesty,0,1,1,1,0,0,0,0,0,Le gouvernement a amnistié le général Amadou Toumani Touré,human rights violations,,state agents,high ranking,,,,Mali,2024-12-15
197,404,The Supreme Military Tribunal granted an amnesty to eight former state leaders for their role in the 1985 coup attempt,,1989,1989-11-21,,,0,,0,human rights crimes are not relevant to this amnesty,0,0,0,0,0,0,0,0,0,Le Tribunal militaire suprême a amnistié huit anciens dirigeants de l'État pour leur rôle dans la tentative de coup d'État de 1985.,dissent / political crimes; armed opposition,,state agents; protesters / political prisoners; armed opposition,,,,,Guinea-Bissau,2024-12-15
611,100,"President Virgilio Barco decreed an amnesty for 35 guerrillas for participating in the Palace of Justice siege in 1985, and members of other insurgent groups for rebellion, sedition, and mutiny",Decree 206 of 1990,1990,1990-01-22,,,0,"The Barco government attempted to demobilize the guerrillas via the Iniciativa para la Paz (Initiative for Peace), requiring the guerrillas to dismantle their military apparatus, surrender their weapons, and reintegrate into society.",0,human rights crimes were excluded from amnesty,0,0,0,1,1,1,0,1,0,"Le président Virgilio Barco a décrété une amnistie pour 35 guérilleros ayant participé au siège du Palais de justice en 1985, et pour les membres d'autres groupes d'insurgés pour rébellion, sédition et mutinerie.",armed opposition,rank and file,armed opposition,,executive; legislative act,289,625; 626,Colombia,2024-12-15
736,290,"Parliament passed an amnesty for thousands of common criminals and prominent political prisoners in ""especially justified"" circumstances",,1986,1986-07-17,,,0,"Fugitive Soldarity figures who reported to the police by Dec 31 and revealed their activities, and pledged to abandon them, would have their charged dropped.",0,human rights crimes are not relevant to this amnesty,0,0,0,0,0,0,0,0,0,"Le Parlement a adopté une amnistie pour des milliers de criminels de droit commun et d'éminents prisonniers politiques dans des circonstances ""particulièrement justifiées"".",dissent / political crimes; regular crime,,protesters / political prisoners; regular convicts,,,,,Poland,2024-12-15
30,91,"Decree No. 11 provided amnesty to citizens for political offences and associated common crimes committed between September 2, 1969, and May 28, 1981",,1981,1981-05-28,"Decreto No. 11, La Gaceta, No. 23.415 was passed by the Asamblea Nacional Constituyente on May 28, 1981. This amnesty covers political and related common crimes committed between September 2, 1969 and the enactment of the amnesty law. The legislation helped a large number of Hondurans, who were detained for several reasons. The amnesty not only pardoned, but also reduced sentences. It does not cover repeat offenders, people on trial for crimes of parricide (the killing of parent, murder, infanticide, and robbery with murder.",,0,,0,human rights crimes are not relevant to this amnesty,0,1,1,0,0,0,0,0,0,Le décret n° 11 prévoit l'amnistie des citoyens pour les délits politiques et les crimes de droit commun connexes commis entre le 2 septembre 1969 et le 28 mai 1981.,dissent / political crimes,rank and file,protesters / political prisoners; regular convicts,,legislative act,,,Honduras,2024-12-15
287,840,"President Arroyo extended an amnesty (Proclamation No. 1377) to members of the Communist Party of the Philippines armed wing, the New People's Army (CPP-NPA-NDF), and other communist rebel groups for crimes committed to further their political beliefs",,2007,2007-09-06,,convicts.,0,"- Application for the grant of amnesty shall be filed under oath with the NCSI or P/CPOC-ACs within six (6) months from the effectivity of this Proclamation - Applicants with firearms should turnover their firearms within thirty (30) days from their filing of application for amnesty without incurring liability for illegal possession thereof. Thereafter, illegal possession of firearms by any applicant or amnesty grantee shall be a ground for denial or revocation of the amnesty, without prejudice to legal prosecution for such illegal possession.",0,human rights crimes were excluded from amnesty,0,1,0,1,1,0,1,0,0,"La présidente Arroyo a accordé une amnistie (proclamation n° 1377) aux membres de la branche armée du Parti communiste des Philippines, la Nouvelle armée du peuple (CPP-NPA-NDF), et à d'autres groupes rebelles communistes pour des crimes commis dans le cadre de leurs convictions politiques.",dissent / political crimes; armed opposition,rank and file,armed opposition,,executive,209,411,Philippines,2024-12-15
73,145,President Hernán Siles decreed an amnesty (Decreto Supremo 20565) to 7 individuals for stealing from the Armed Forces,Decreto Supremo 20565,1984,1984-10-25,,convicts,0,,0,human rights crimes are not relevant to this amnesty,0,1,0,1,1,1,0,0,0,Le président Hernán Siles a décrété une amnistie (Decreto Supremo 20565) en faveur de 7 personnes pour avoir volé les forces armées.,armed opposition,rank and file,armed opposition,,legislative act,200,401,Bolivia,2024-12-15
1089,437,President Alassane Ouattara declared an amnesty for approximately 800 political prisoners,,2018,2018-08-06,The amnesty most importantly pertains to crimes committed during the country's 2010-11 crisis.,,0,,0,human rights crimes were included in amnesty,0,1,0,0,0,0,0,0,0,Le président Alassane Ouattara a déclaré une amnistie pour environ 800 prisonniers politiques.,dissent / political crimes,,protesters / political prisoners,,executive,,,Cote d'Ivoire,2024-12-15
134,365,"The ""Law on Amnesty for People who Committed Crimes during the Counter-Terrorist Operation in the Caucasus"" provided amnesty to federal servicemen for crimes committed during anti-terrorist operations in the North Caucasus",,1999,1999-12-13,,convicts.,0,"- The resolution will be valid for six months after its enactment. By 1 Feb 2000. On 25 Feb 2000, the State Duma extended the amnesty until 15 May 2000. - Chechen fighters who voluntarily surrender and hand over their weapons",0,human rights crimes were included in amnesty,0,1,0,1,1,0,1,0,0,"La ""loi sur l'amnistie pour les personnes ayant commis des crimes au cours des opérations antiterroristes dans le Caucase"" prévoit l'amnistie des militaires fédéraux pour les crimes commis au cours des opérations antiterroristes dans le Caucase du Nord.",armed violence against rebels,not specified,state agents,high ranking,legislative act,401,852,Russian Federation,2024-12-15
716,775,The government granted an amnesty to insurgents on the Thai-Burmese border,,1988,1988-11-01,,,0,,0,don't know,0,1,0,1,1,0,0,0,0,Le gouvernement a amnistié les insurgés de la frontière thaïlandaise et birmane.,armed opposition,not specified,armed opposition,,,253,511,Myanmar,2024-12-15
805,345,"(Yugoslavia) The government passed an amnesty for political prisoners and common criminals, including Mihajlo Mihajlov, for minor political offences",,1977,1977-11-24,,common criminals.,0,,0,human rights crimes were excluded from amnesty,0,0,0,0,0,0,0,0,0,"(Yougoslavie) Le gouvernement amnistie les prisonniers politiques et les criminels de droit commun, dont Mihajlo Mihajlov, pour des délits politiques mineurs.",dissent / political crimes; regular crime,,protesters / political prisoners; regular convicts,,,,,Serbia,2024-12-15
97,434,Law No. 97-040 provided amnesty to individuals convicted of politically motivated offences during the tenure of former President Nicephore Soglo,Law 97-040,1997,1997-09-01,,convicts,0,,0,human rights crimes are not relevant to this amnesty,0,1,0,0,0,0,0,0,0,La loi n° 97-040 a amnistié les personnes condamnées pour des infractions à caractère politique pendant le mandat de l'ancien président Nicéphore Soglo.,dissent / political crimes; armed opposition,rank and file,protesters / political prisoners; armed opposition,,executive; legislative act,,,Benin,2024-12-15
255,235,"The National Salvation Junta offered an amnesty (Decree-Law 173/74) to military deserters and draft evaders for indiscipline, and to political prisoners for crimes against state security",Decreto Lei 173/74,1974,1974-04-26,,,0,- Draft evaders are given 15 days to report for service after returning to Portugal. - Amnesty only applies to those to report for military service promptly.,0,human rights crimes are not relevant to this amnesty,0,1,0,0,0,0,0,0,0,"La Junte de salut national a offert une amnistie (décret-loi 173/74) aux déserteurs militaires et aux réfractaires pour indiscipline, ainsi qu'aux prisonniers politiques pour crimes contre la sécurité de l'État.",dissent / political crimes,not specified,protesters / political prisoners,,executive,,,Portugal,2024-12-15
800,679,President Ali Abdullah Saleh offered an amnesty to all imprisoned supporters of Hussein al-Houthi for fighting an insurgency against the state in 2004,,2005,2005-09-25,,,0,,0,human rights crimes were included in amnesty,0,0,0,1,0,0,0,0,0,Le président Ali Abdullah Saleh a offert une amnistie à tous les partisans emprisonnés de Hussein al-Houthi pour avoir combattu l'insurrection contre l'État en 2004.,dissent / political crimes; terrorism; armed opposition,rank and file; leaders,protesters / political prisoners; armed opposition,,executive,,,Yemen,2024-12-15
1095,530,"The Federal Pardon Board granted an amnesty to Birtukan Midekssa, leader of the opposition Unity for Democracy and Justice party, for treason for her alleged role in the post-May 2005 election unrest",,2010,2010-10-06,"According to the Ministry of Justice, Birtukan was freed from her sentence after making a personal appeal to Prime Minister Meles Zenawi in which she allegedly admitted her violations of an earlier clemency. Birtukan had received a life sentence following her conviction on treason charges for her alleged roles in the post-May 2005 political unrest.",,0,"Admit her ""crimes""",0,human rights crimes are not relevant to this amnesty,0,0,0,0,0,0,0,0,0,"La Commission fédérale des grâces a amnistié Birtukan Midekssa, chef du parti d'opposition Unité pour la démocratie et la justice, pour trahison en raison de son rôle présumé dans les troubles qui ont suivi les élections de mai 2005.",dissent / political crimes,,protesters / political prisoners,,executive,,,Ethiopia,2024-12-15
636,651,The government granted an amnesty to 201 political prisoners,,1982,1982-03-29,,,0,,0,don't know,0,0,0,0,0,0,0,0,0,Le gouvernement a amnistié 201 prisonniers politiques.,dissent / political crimes,not specified,protesters / political prisoners,,,,,Egypt,2024-12-15
250,451,"The ""Abidjan Accords"" provided amnesty to all members of the Revolutionary United Front of Sierra Leone (RUF/SL) for any crimes committed to further their organizational beliefs",,1996,1996-11-30,,,0,,0,human rights crimes were included in amnesty,0,1,0,1,1,0,1,1,0,"Les ""Accords d'Abidjan"" ont amnistié tous les membres du Front révolutionnaire uni de Sierra Leone (RUF/SL) pour tous les crimes commis dans le cadre de leurs convictions organisationnelles.",human rights violations; armed opposition,not specified,armed opposition,,legislative act,382,818,Sierra Leone,2024-12-15
1065,436,President Mohamed Bazoum extended an amnesty to Boko Haram jihadists who turned themselves in,,2016,2016-12-27,"The president Bazoum promised security, support and no judicial prosecution for all compatriots leaving the Boko Haram sect. To this end were set up a transit camp as well as a social reinsertion programme.",,0,Surrender.,1,human rights crimes were included in amnesty,0,1,0,1,1,0,1,0,0,Le président Mohamed Bazoum a accordé une amnistie aux djihadistes de Boko Haram qui se sont rendus.,terrorism,not specified,armed opposition,,executive,13639,14668,Niger,2024-12-15
303,732,"President Chun Doo-hwan granted an amnesty to 5,221 prisoners, including 46 political prisoners",,1981,1981-03-02,,,0,,0,don't know,0,1,0,0,0,0,0,0,0,"Le président Chun Doo-hwan a amnistié 5 221 prisonniers, dont 46 prisonniers politiques.",dissent / political crimes; regular crime,,protesters / political prisoners; regular convicts,,executive,,,South Korea,2024-12-15
732,150,The government provided an amnesty to four political prisoners,,1984,1984-01-01,,,0,,0,human rights crimes are not relevant to this amnesty,0,0,0,1,0,0,0,0,0,Le gouvernement a amnistié quatre prisonniers politiques.,dissent / political crimes,,protesters / political prisoners,,,,,Paraguay,2024-12-15
94,434,"The Central Committee-Political Bureau of the People's Revolution Party of Benin passed an amnesty for 90 prisoners for coup attempts in 1975 and 1977, or for being a member of the Communist Party",,1989,1989-08-30,,"political prisoners, convicts and refugees",0,,0,human rights crimes are not relevant to this amnesty,0,1,0,0,0,0,0,0,0,"Le comité central-bureau politique du Parti de la révolution populaire du Bénin a amnistié 90 prisonniers pour des tentatives de coup d'État en 1975 et 1977, ou pour leur appartenance au Parti communiste.",dissent / political crimes; armed opposition,rank and file; leaders,protesters / political prisoners; armed opposition,,executive,,,Benin,2024-12-15
1138,652,"Legislative Decree No. 61 provided a general amnesty to Islamists and extremists, protestors, military deserters, and those guilty of murder, theft, and fraud for crimes committed before March 31, 2011",Legislative Decree No. 61 (2011),2011,2011-03-07,,,0,,0,human rights crimes are not relevant to this amnesty,0,0,0,1,0,0,0,0,0,"Le décret législatif n° 61 prévoit une amnistie générale pour les islamistes et les extrémistes, les manifestants, les déserteurs militaires et les personnes coupables de meurtre, de vol et de fraude pour des crimes commis avant le 31 mars 2011.",corruption or other economic crimes; dissent / political crimes; dereliction of duty; armed opposition,not specified,protesters / political prisoners; draft dodgers / deserters; armed opposition,,executive,,,Syria,2024-12-15
394,346,The government granted an amnesty to 220 Serb prisoners of war,"Annex 1A, Article 9 of the Dayton Agreement",1996,1996-01-19,,prisoners,0,,0,don't know,0,1,0,1,1,1,0,1,0,Le gouvernement a amnistié 220 prisonniers de guerre serbes.,dissent / political crimes; armed opposition,rank and file,protesters / political prisoners; armed opposition,,legislative act,389,835,Bosnia and Herzegovina,2024-12-15
920,560,"The ""South African Interim Constitution of 1993"" provided amnesty for ""acts, omissions and offences associated with political objectives"" committed during apartheid",,1994,1994-04-27,,,0,"- The deadline for the submission of applications was extended from 6 Dec 1996, to 30 Sep 1997. - The Amnesty Committee consists of three judges and two lawyers. It is empowered to recommend amnesty for any applicant who fulfils certain criteria including inter alia that the person makes a full disclosure of the facts. Firstly, the applicant was required to submit a written application on the prescribed amnesty application form and this application had to be made under oath and attested by a commissioner of oaths. Secondly, where necessary the applicant may be called to appear before a public hearing of the Amnesty Committee.",0,human rights crimes were included in amnesty,0,1,1,1,1,1,0,1,0,"La ""Constitution intérimaire sud-africaine de 1993"" prévoit une amnistie pour les ""actes, omissions et infractions liés à des objectifs politiques"" commis pendant l'apartheid.",human rights violations; dissent / political crimes; armed opposition,not specified,state agents; protesters / political prisoners; armed opposition,high ranking; low ranking,legislative act,345,766,South Africa,2024-12-15
689,666,The government passed an amnesty to security prisoners from the Gaza Strip and the West Bank,,1981,1981-05-04,,,0,,0,human rights crimes were excluded from amnesty,0,0,0,1,1,0,1,0,0,Le gouvernement a accordé une amnistie aux prisonniers de sécurité de la bande de Gaza et de la Cisjordanie.,armed opposition,rank and file,protesters / political prisoners; armed opposition,,,234,472,Israel,2024-12-15
483,816,"The government granted an amnesty to over 6,000 prisoners, including many senior officials of former South Vietnam",,1987,1987-09-13,,,0,,0,human rights crimes are not relevant to this amnesty,0,0,0,0,0,0,0,0,0,"Le gouvernement a amnistié plus de 6 000 prisonniers, dont de nombreux hauts fonctionnaires de l'ancien Viêt Nam du Sud.",dissent / political crimes,,protesters / political prisoners,,executive,,,Vietnam,2024-12-15
201,404,"The military junta offered a blanket amnesty to anyone involved in the September 14, 2003 coup",,2003,2003-09-28,,,0,,0,human rights crimes were included in amnesty,0,1,0,1,0,0,0,0,0,La junte militaire a offert une amnistie générale à toute personne impliquée dans le coup d'État du 14 septembre 2003.,human rights violations; armed opposition,not specified,armed opposition,,executive,,,Guinea-Bissau,2024-12-15
50,155,President Salvador Allende granted an amnesty to members of the Movimiento de la Izquierda Revolucionaria (MIR) for political and related crimes,,1971,1971-01-05,"In 1971, President Salvador Gossens Allende gave amnesties to members of the Movimiento de la Izquierda Revolucionaria, a Chilean leftist insurgent group supported by Cuba. This group tried to create a Marxist state in Chile and the amnesty allowed them to operate openly. The amnesty covered the political crimes or related crimes this opposition group committed.",,0,,0,don't know,0,0,0,0,0,0,0,0,0,Le président Salvador Allende amnistie les membres du Movimiento de la Izquierda Revolucionaria (MIR) pour des délits politiques et autres.,armed opposition,,armed opposition,,,,,Chile,2024-12-15
597,482,"Law 96020 provided amnesty to soldiers responsible for mutinies on April 18 to 21 and May 18 to 20, 1996",Law 96020,1996,1996-05-30,,,0,"Amnesty will take effect once offenders return to their barracks and hand over arms, ammunitions and vehicles to the authorities",0,human rights crimes were excluded from amnesty,0,1,0,0,0,0,0,0,0,La loi 96020 amnistie les soldats responsables des mutineries du 18 au 21 avril et du 18 au 20 mai 1996.,armed opposition,rank and file,armed opposition,,legislative act,,,Central African Republic,2024-12-15
