vettingID,ccode_cow,invalid,alterationOf,policyName,dateLaw,narrative,yearStart,yearEnd,policySource,enactment,implemented,implementationNotes,courtChallenge,numberInvestigated,sources,startedDemocraticTransition,fitsPostAutocraticTJ,startedIntraConflBefore,fitsConflictTJ,beganDuringIntraConfl,beganAfterIntraConfl,type_dismissal,type_ban,type_declassification,type_perjury,policy_type,grp_exe,grp_legis,grp_judiciary,grp_public,grp_police,grp_military,grp_parties,grp_other,groups_targeted,inst_exe,inst_legis,inst_judiciary,inst_public,inst_police,inst_military,inst_parties,inst_other,inst_targeted,sum_inst,ban_from_elected,implementation,fairness,hearingsPublic,appealJudgment,var_fairness,policyName_fr,ucdpConflictID,ucdpDyadID,targetingWhy,policyProcedure,targetingAffiliationRank,targetingPositionSought,targetingAffiliation,targetingPositionsRank,sanctions,country,tjet_version
69,451,0,,Peace Agreement between the Government of Sierra Leone and the Revolutionary United Front of Sierra Leone,,"On November 1, 1996 the Government of Sierra Leone and the Revolutionary United Front of Sierra Leone signed the peace agreement to end the civil war ravaging the country (National Legislative Bodies, 1996). Under Article 25 of the peace agreement, the police force is set to be vetted for human-rights abuses, among other reasons. There is no known ban length or appeals process. Furthermore, due to corruption and instability, no programs or reforms were established, and in 1997, with the overthrow of the government by the Revolutionary United Front and its allies, this peace agreement was discarded, ending its chance of implementation (National Legislative Bodies, 1996; Peace Accord Matrix 2011).",1996,1997,Other,peace agreement,No,,no court challenge,,"National Legislative Bodies, Peace Agreement between the Government of Sierra Leone and the Revolutionary United Front of Sierra Leone, 1 November 1996. Web. <http://www.refworld.org/docid/3ae6b5064.html> (accessed 12 August 2013). Peace Accords Matrix, Kroc Institute for International Peace Studies, University of Notre Dame. 3 June 2011. <https://peaceaccords.nd.edu/matrix/status/14/police_reform> (accessed 12 August 2013).",1,0,1,1,0,0,0,0,0,0,,,,,,,,,,,,,,,,,,,0,0,,,,don't know,no,,Accord de paix entre le gouvernement de la Sierra Leone et le Front révolutionnaire uni de la Sierra Leone,382,818,specific individual conduct,peace agreement,low; high,,police (includes ordinary police and secret police informants),,dismissal from current employment,Sierra Leone,2024-08-20
54,343,0,,Lustration Law,,"The Macedonian parliament passed a lustration law, its first effort at vetting, in 2008. The law conforms to recommendations that Macedonia address ""the heritage of [the] former communist totalitarian system"" that was responsible for many abuses (Council of Europe 2013, 28). Under the terms of the original law, names of individuals who had been employed by or cooperated with former intelligence services were to be published in the Macedonian Official Gazette. The President of Macedonia, members of parliament and their staff, and judges were required to undergo lustration investigations (Bohnet and Bojadzieva 2011, 68). The law also included numerous non-governmental professions, including journalists, clergy, and NGO activists, although these provisions were eventually struck down by the Constitutional Court (Council of Europe 2013, 28). The lustration commission has investigated several hundred individuals. However, it has faced shortages of funding and staff, and concerns about its effectiveness were raised when an initial round of lustration found no collaborators among the ruling party (Bohnet and Bojadzieva 2011, 68). As of 2013, over 30 people had been declared former collaborators. Although several successfully appealed the Commission’s decision, concerns remain about due process (Council of Europe 2013, 29). The Constitutional Court has, on multiple occasions, limited the scope of the law. It ruled that lustration could not be applied to many non-governmental professions; it limited the historical period in question to the Communist era (1945-1991); and it ruled against the automatic publishing of names, due to concerns about privacy rights (Council of Europe 2013, 28-29; Marusic 2012; Bohnet and Bojadzieva 2011, 67). These decisions have resulted in a much weaker law. Most importantly, the lustration Commission no longer has a mandate for sanctions. It is noted that ""the appropriate court can ban [lustrated individuals] from taking public office,"" but further evidence confirming a ban as part of the official policy was not present (Bohnet and Bojadzieva 2011, 67-68). In response, in 2012 the majority party in the Macedonian parliament submitted and approved a new lustration law very similar to the 2008 version. Its approval by the Macedonian President was met with controversy, and it faces renewed Constitutional Court challenges. As of the time of writing, the legal status of lustration in Macedonia is uncertain (Marusic 2012; Council of Europe 2013, 29-30). The Constitutional Court has, on multiple occasions, limited the scope of the law, saying it could not be applied to many non-governmental professions, limiting the period in question to the Communist era, and ruling against the publishing of names due to privacy concerns.",2008,2012,Legislature/Parliament,legislative act,Yes (fully or partially),,court challenge modified the policy,324,"Bohnet, Henri and Daniela Bojadzieva. ""Coming to Terms with the Past in the Balkans: the Lustration Process in Macedonia."" Konrad-Adenauer-Stiftung International Reports. 1/2011. 58-70. Council of Europe. Parliamentary Assembly: Monitoring Committee. Post-monitoring dialogue with ""the former Yugoslav Republic of Macedonia."" 7 June 2013. Marusic, Sinisa Jakov. ""Activist Sues Macedonian President Over Lustration Law."" Balkan Transitional Justice Initiative. 24 July 2012. Accessed 21 July 2013 at <http://www.balkaninsight.com/en/article/macedonian-president-sued-over-lustration-law>",1,0,1,0,0,0,0,0,1,0,1,,,,,1,,,,1,1,1,1,,,,,,2,3,0,1,,don't know,yes,2,Loi sur la lustration,,,membership or affiliation with a certain group or organization,legislation,low; high,legislature; executive; judiciary,police (includes ordinary police and secret police informants),low; high,declassification,North Macedonia,2024-08-20
20,42,0,,Dismissal of military officers,,"When he took office on 16 August 1978, President Guzman dismissed several senior military officers whom he accused of ""interfering with the vote-counting in an attempt to keep him out of office."" These officers included General Rafael Neit Nivar Seijas, Major-General Salvador Lluberes Montas, Lieutenant-General Juan Rene Beauchamps Javier, and Vice-Admiral Francisco Rivera Caminero (""Dominican Republic"" 1978, 29278). Another source states that the targeted generals were ""associated with repression"" (Espinal and Hartlyn 1999, 483), suggesting that human rights violations might be part of the motivation behind the dismissals. There does not seem to have been an appeals process. Since this was not a written policy, it is fully implemented (any implementation is full implementation).",1978,1978,Executive,executive other,Yes (fully or partially),Policy was a one-time decision taken by Presidential Prerrogative to remove Armed Forces personnel (fully implemented).,no court challenge,,"""Dominican Republic."" Keesing's Contemporary Archives 27 October 1978, 29278. Espinal, Rosario and Jonathan Hartlyn. ""The Dominican Republic: The Long and Difficult Struggle for Democracy."" Democracy in Developing Countries: Latin America (2nd Edition). Eds. Larry Diamond, Jonathan Hartlyn, Juan Linz and Martin Lipset. Boulder: Lynne Reiner Publishers, 1999. Bobea, Lilian. 2006. ‘La Seguridad y la Defensa en la República Dominicana en el Siglo XXI’. Programa de Seguridad y Defensa en Iberoamerica. https://www.iugm.es/adefal/ (February 24, 2023). ‘Importantes cambios militares en la República Dominicana’. 1978. El País. https://elpais.com/diario/1978/08/18/internacional/272239212_850215.html (February 24, 2023).",1,1,1,0,0,0,0,0,0,0,,,,,,,,,,,,,,,,,,,0,0,,,The decision is considered fair as part of presidential legal powers to remove members of the Armed Forces.,don't know,,,Révocation des officiers militaires,,,specific individual conduct,don't know,high,armed forces,armed forces,high,dismissal from current employment,Dominican Republic,2024-08-20
159,290,0,63,Constitutional Court ruling truncated 2006 Lustration Purification Law,2007-05-11,"""In its complex judgment of 11 May 2007,10 with nine out of eleven judges submitting separate opinions, the Constitutional Tribunal found parts of the Preamble and the whole or parts of some fifteen articles of the 2007 law incompatible with the Constitution."" (Millard 2021, 112)",2007,,,court ruling,Yes (fully or partially),,don't know,"~60,000 by 2016","Ash, Timothy. ""Cleansing Poland of the 'red' poison; The Poles have made a complete mess of dealing with their Communist past."" The Globe and Mail (Canada), 25 May 2007. LexisNexis Academic. 22 June 2013 De, Greiff Pablo., and Alexander Mayer-Rieckh. Justice as prevention: Vetting public employees in transitional societies. New York: Social Science Research Council, 2007. Febbrajo, Alberto, and Wojciech Sadurski. Central and Eastern Europe after transition: Towards a new socio-legal semantics. Farnham: Ashgate Pub., 2010. Penketh, Anne. ""POLESAPART; The journey from communist state to 21st-century democracy has culminated in a dilemma for Poland: To purge the poison of he past or to forgive and forget . Anne Penketh reports from Krakow; Opening the files."" The Independent [London], 28 May 2007, First Edition ed. LexisNexis Academic. 22 June 2013 Scally, Derek. ""Poland's top court finds communist vetting law to be unconstitutional."" The Irish Times 11 May 2007: 11. LexisNexis Academic. 22 June 2013 Stan, Lavinia and Nadya Nedelsky. Encyclopedia of Transitional Justice Volume 2. New York: Cambridge University Press, 2013. Print. Horne 2017 ch2; Memory of Nations 2019; Millard 2021",1,0,0,0,0,0,0,0,1,1,2,,,,,1,,,,1,1,1,1,1,,,,,2,4,1,1,,public,don't know,1,L'arrêt de la Cour constitutionnelle a tronqué la loi de 2006 sur la purification de la lustration,,,membership or affiliation with a certain group or organization,,low; high,"public sector employee (bureaucrats, low-rank nominated or elected officials); legislature; executive; judiciary",police (includes ordinary police and secret police informants),low; high,dismissal and ban upon lustration lie; declassification,Poland,2024-08-20
118,41,0,,Dismissals of military officers and vetting of interim police force,,"In 1991, the democratically-elected government of Jean-Bertrand Aristide was overthrown in a military coup. The military government, led by Raoul Cedras, committed numerous human rights abuses, including extrajudicial killings. In 1994, the United States military invaded Haiti and restored Aristide to power. In late 1994 and early 1995, Haitian president Jean-Bertrand Aristide retired or removed more than 30 top army officers (a different source counts 66 dismissals). Many were accused of human rights violations during the military regime. However, many of the same individuals were part of the coup that ousted Aristide in 1991, raising the possibility that the dismissals were politically motivated. After a few rounds of dismissals, all of Haiti's military officers above the rank of major had been dismissed or replaced (Hamilton Spectator 1 Dec 1994; Human Rights Watch 1995). No information is available regarding appeals processes or challenges to the policy. Later in 1995, the Haitian armed forces were disbanded entirely, also by executive fiat. However, that policy appears to have been separate from the quasi-formal dismissals discussed here: at the time he announced these dismissals, Aristide claimed that he could not abolish the military In 1991, the democratically elected government of Jean-Bertrand Aristide was overthrown in a military coup. The military government, led by Raoul Cedras, committed numerous human rights abuses, including extrajudicial killings. In 1994, the United States military invaded Haiti and restored Aristide to power. Shortly thereafter, vetting procedures were instituted in order to assess candidates for an interim police force tasked with maintaining order. Also, as entrants to the training academy that would produce a permanent police force were vetted. Various sources confirm that the vetting procedures were intended to remove human rights violators from service (e.g. Human Rights Watch 1995, 6-7). The vetting policy and interim police force were a joint project of the Haitian government and the United States, Canada, and other international actors. However, various sources report that the policy was nominally headed by Haitian officials. For example, Aristide named a member of his cabinet to ""oversee the vetting process"" and that the commission charged with screening individual soldiers was chosen jointly by ""senior officials of the U.S. and Haitian governments"" (Washington Post, 27 Dec 1994; Washington Post, 9 Oct 1994; Human Rights Watch 1995, 12). There was no formal law, decree, or declaration of the policy, so it is best described as a ""quasi-formal"" policy. The interim police force was made up of former Haitian army soldiers. Initial plans suggested that approximately half of the Haitian military would be included in the new force (at the time of Aristide's return, Haitian armed forces numbered approximately 7,000). Individuals who had committed human rights violations were banned from According joining the new force (Human Rights Watch 1995, 12-14). A commission of high-ranking military officials was mandated with conducting the vetting. Agents of the commission visited army companies and ""conducted inquiries regarding the reputations of individual soldiers,"" including inquiries with local Haitian civilians and with soldiers' commanding officers. However, these procedures were significantly flawed: the commission lacked a mechanism to further investigate alleged abuses, nor is there any evidence of an appeals process for implicated individuals. Those who did not pass the commission's initial ""investigation"" were simply excluded (Human Rights Watch 1995, 12-14). It is estimated that less than 1,000 individuals were excluded from the interim force. As a result of the commission's poor implementation, several observers were concerned that many soldiers implicated in human rights abuses remained in the interim force (Human Rights Watch 1995).",1994,1995,,executive other,Yes (fully or partially),"Evidence of removal in December 1994. Vetting policy was an indirect process since it vetted the personnel not selected by the Committee. IACHR counted at least 3000 people selected (IACHR, 1995, par.253)",no court challenge,3000,"Aucoin, Louis. ""Haiti's Constitutional Crisis."" Boston University International Law Journal 17.1 (1999): 115-140. Farah, Douglas. ""Army Issue Nudges U.S., Aristide Toward Dispute."" Washington Post 27 Dec 1994. Web (LexisNexis), 12 Jan 2014. Farah, Douglas. ""Haiti Savors Election With Army Out of Picture."" Washington Post 24 Jun 1995. Web (LexisNexis), 13 Jan 2014. Graham, Bradley. ""U.S. Pessimistic about Democracy in Haiti."" Washington Post 9 Oct 1994. Web (LexisNexis), 12 Jan 2014. ""Haiti military leaders retired; More than 30 ousted from power posts."" Hamilton Spectator (Ontario, Canada), 1 Dec 1994. Web (LexisNexis), 13 Jan 2014. ""Haiti: Security Compromised."" Human Rights Watch. 1995. Web 12 Jan 2014. http://www.hrw.org/reports/1995/03/01/security-compromised-recycled-haitian-soldiers-police-front-line Inter-American Commission on Human Rights. 1995. ‘Haiti 1995 - Capitulo V’. http://www.cidh.org/countryrep/Haiti95sp/cap.5.htm#Reinstalaci%C3%B3n%20del%20r%C3%A9gimen%20democr%C3%A1tico (February 24, 2023). Kritz, Neil. Transitional Justice: How Emerging Democracies Reckon with Former Regimes, Volume III: Laws, Rulings, and Reports. Washington, DC: United States Institute for Peace, 1995. Nicholls, David. From Dessalines to Duvalier: Race, Colour and National Independence in Haiti. New Brunswick: Rutgers University Press, 1996.",0,0,1,0,0,0,0,0,0,0,,,,,,,,,,,,,,,,,,,0,0,,,Fairness is not under dispute since President Aristide had the powers to remove top ranks of the Armed Forces. IACHR stated in their Country Report on Haiti in 1995 that there were critique by victims (due to selection of personnel involved in human rights violations) and non-selected personnel (because there were any instance to challenge the decision of the Committee).,,,,Licenciement d'officiers militaires et contrôle des forces de police intérimaires,,,specific individual conduct; membership or affiliation with a certain group or organization,,,police (includes ordinary police and secret police informants); armed forces,police (includes ordinary police and secret police informants); armed forces,,dismissal from current employment,Haiti,2024-08-20
26,530,0,,Purge of Workers' Party,,"Following the overthrow of the military junta known as the Derg, the transitional government engaged in a vetting policy best described as a purge and replacement of the entire civil service. All individuals who held an official position in the military junta were dismissed from their positions, as were all members of the Workers' Party of Ethiopia (the political wing of the former regime). ""Thousands of people employed in [executive] ministries, courts, mass organizations (for urban dwellers, peasants, women, and youth), and security forces were thus dismissed"" (Tronvoll 2013, 171). No information is available regarding an appeals process, challenges to the policy, or the processes by which it was implemented. However, the circumstances of the case make this coder deeply suspicious that targeted individuals received adequate due process. More complete information about this policy was not available.",1991,1991,Executive,executive other,Yes (fully or partially),,don't know,,"""Transitional Period Charter of Ethiopia."" Signed 22 July 1991 in Addis Ababa. Retrieved at http://www.mlgi.org.za/resources/local-government-database/by-country/ethiopia/peace-agreements/The%20Transitional%20Period%20Charter%20of%20Ethiopia.PDF Tronvoll, Kjetil. ""Ethiopia."" Encyclopedia of Transitional Justice, Volume 2. Ed. Lavinia Stan and Nadya Nedelsky. New York: Cambridge University Press, 2013. 167-173. Print. Tronvoll, Kjetil, Charles Schaefer, and Girmachew Alemu Aneme. ""Concluding the Main Terror Trial."" The Ethiopian Terror Trials: Transitional Justice Challenged. Ed. Kjetil Tronvoll, Charles Schaefer, and Girmachew Alemu Aneme. 2009. 136-152. Print.",0,0,1,0,0,0,0,0,0,0,,,,,,,,,,,,,,,,,,,0,0,,,"Blanket application and nature of ""victors' justice"" contribute to inference that policy was applied arbitrarily. Tronvoll (p 172) says of other elements of the TJ efforts: ""many deficiencies of the trials violated the human rights of the accused and undermined the principles of a fair trial.""",don't know,don't know,,Purge du Parti des travailleurs,,,membership or affiliation with a certain group or organization,executive decree,low; high,"public sector employee (bureaucrats, low-rank nominated or elected officials); police (includes ordinary police and secret police informants); legislature; executive; judiciary; armed forces","public sector employee (bureaucrats, low-rank nominated or elected officials); police (includes ordinary police and secret police informants); legislature; executive; judiciary; armed forces",low; high,dismissal from current employment,Ethiopia,2024-08-20
80,355,0,16,Classified Information Protection Act [Law on Classified Information],2001-02-24,"On 24 April 2002, the Bulgarian Parliament adopted the Classified Information Protection Act [Law on Classified Information] through legislation. This law repealed the Access to the Documents of the Former State Security Files Act and sealed the secret archives. It created the State Commission on Information Security to issue clearance permits to public servants and army officers seeking to work with NATO classified information. Those who collaborated with the secret police were denied permits. As a result, some important state officials were denied clearance, and several ambassadors to NATO countries and army generals representing the Bulgarian General Staff to NATO were unable to assume their posts.",2002,2006,Legislature/Parliament,legislative act,Yes (fully or partially),,don't know,,"Horne, C. (2017). Building Trust and Democracy. Transitional Justice in Post-Communist Countries. Oxford University Press. Federal Commissioner for the Records of the State Security Service of the former German Democratic Republic. (2014).The European Network of Official Authorities in Charge of the Secret Police Files.",1,1,0,0,0,0,1,1,0,0,2,,,,,1,,,,1,1,,,1,,1,,,2,3,0,1,,don't know,,1,Loi sur la protection des informations classifiées [Loi sur les informations classifiées].,,,specific individual conduct; membership or affiliation with a certain group or organization,legislation,don't know,"public sector employee (bureaucrats, low-rank nominated or elected officials); executive; armed forces",police (includes ordinary police and secret police informants),low; high,dismissal from current employment; ban from future employment,Bulgaria,2024-08-20
60,135,0,,Military dismissals,,"During the 1980s and early 1990s, Peru suffered an internal conflict between government forces and the Sendero Luminoso (Shining Path) revolutionary movement. Both sides were accused of committing serious human rights violations throughout the course of the struggle. President Alberto Fujimori made the defeat of Sendero Luminoso a major objective of his early administration. On July 16, 1991, the defense minister of Peru announced that some vetting of the armed forces had taken place: ""71 members of the armed forces have been dismissed in the last year for human rights, and drug trafficking"" (Keesing's).",1991,1991,Executive,executive other,Yes (fully or partially),The source states that the dismissals had already been carried out.,don't know,,"""Peru."" Keesing's Record of World Events News Digest for July 1991, p. 38334. Print.",1,0,1,1,0,0,0,0,0,0,,,,,,,,,,,,,,,,,,,0,0,,,No data is available about the process,don't know,,,Licenciements militaires,292,,don't know,don't know,don't know,armed forces,armed forces,don't know,dismissal from current employment,Peru,2024-08-20
25,366,0,,Disclosure Law,1995-02-06,"The 1995 Disclosure Act accompanied the Citizenship Law and established procedures to both identify and make public the names of individuals who worked for or collaborated with the KGB or Nazi security services. In 1995, a law established a process for ""securing information about, registering, and, whenever necessary, making public"" the names of agents and collaborators with secret police during both the Nazi and Soviet eras. Such persons were instructed to disclose their histories of involvement in writing to the Estonian Security Police Board before April 1, 1996; those who did so were forgiven and their names kept secret. Subsequent to the deadline, a commission investigated further claims and published the names of individuals implicated. Investigations and sanctions were not apparently related to the current position or status of targeted individuals (Pettai 2013, 164). The law included an appeals provision by which persons could challenge the charges against them in a confidential court (Pettai 2013, 164). No evidence is available describing the process in detail or documenting the scope of its practical use. Before the 1996 deadline for confidentiality, approximately 1,000 people registered with the Estonian authorities. Between 1998 and 2008, the names of about 600 more were published officially (Pettai 2013, 164).",1995,,Legislature/Parliament,legislative act,Yes (fully or partially),"Before the 1996 deadline for confidentiality, only 1153 people registered with the Estonian authorities. Between 1998 and 2008, the names of about 600 more were published officially (Pettai 2013, 164). The Estonian Security Police Board oversaw the procedures. In the event that an individual failed to register and disclose his past, his name would be publicized in the Riigi Teataja (State Gazette) “as a past agent or accomplice of a foreign occupier” (Vello Pettai 2013, 164). In this way, public disclosure of either previous employment or previous collaboration with the security services would be the consequence for failure to comply. (Horne, Ch 2).",challenged in court with unclear outcome,1153,"Pettai, Vello. ""Estonia."" Encyclopedia of Transitional Justice, Volume 2. Ed. Lavinia Stan and Nadya Nedelsky. New York: Cambridge University Press, 2013. 161-167. Print.",1,1,0,0,0,0,0,0,1,0,1,,,,,1,,,,1,1,1,1,,,1,,,2,4,0,1,"The law included an appeals provision by which persons could challenge the charges against them in a confidential court (Pettai 2013, 164). Burden of proof on KAPO (State). No evidence is available describing the process in detail or documenting the scope of its practical use.",secret,don't know,1,Loi sur la divulgation,,,membership or affiliation with a certain group or organization,legislation,low; high,legislature; executive; judiciary; armed forces,police (includes ordinary police and secret police informants),low; high,declassification,Estonia,2024-08-20
