amnestyID,ccode_cow,mechanismDescription,amnestyName,amnestyYear,start_date,narrative,otherExplain,selfAmnesty,qualifyingProcess,blanket,hrCrimes,SGBV,startedDemocraticTransitionBefore,fitsPostAutocraticTJ,startedIntraConflbefore,fitsConflictTJ,pcj,dcj,peaceSettlement,mediation,mechanismDescription_fr,whatCrimes,oppRank,whoWasAmnestied,stateAgents,enactedHow,ucdpConflictID,ucdpDyadID,country,tjet_version
950,620,President Muammar Gaddafi granted an amnesty to all rebels and soldiers in Misrata who disarmed,,2011,2011-03-02,,,0,"- The amnesty for the rebels in Misrata announced on 29 April 2011, expired at midnight on 2 May 2011. - To benefit from the amnesties, rebels and defecting soliders are both required to surrender and disarm. - The amnesty for rebels is conditional on beneficiaries renouncing violence.",0,human rights crimes are not relevant to this amnesty,0,0,0,1,1,0,1,0,0,Le président Mouammar Kadhafi a accordé une amnistie à tous les rebelles et soldats de Misrata qui ont désarmé.,dissent / political crimes; armed opposition,rank and file,armed opposition,,executive,11346,11980,Libya,2024-12-15
185,359,"Parliament passed an amnesty for individuals who had committed crimes during the armed conflicts in Gagauzia in 1990 and the Dniester region in 1992, conditional on their disarmament",,1995,1995-07-22,,,0,"The amnesty applied to persons who voluntary gave up guns and ammunitions before August 27, 1995. All criminal proceedings against persons charged with various punishable deeds during the 1990-1994 events in Dniester and Gagauzia, as well as against those accused of outrages against national and state symbols, should be halted.",0,don't know,0,1,1,1,1,1,0,0,0,"Le Parlement a adopté une amnistie pour les personnes ayant commis des crimes lors des conflits armés en Gagaouzie en 1990 et dans la région du Dniestr en 1992, à condition qu'elles soient désarmées.",other; armed opposition,not specified,state agents; armed opposition,not specified,legislative act,394,841,Moldova,2024-12-15
978,626,"President Salva Kiir Mayardit declared amnesty to rebel leaders operating in the country's Jonglei, Unity and Upper Nile state, as well as the combatants serving under them.",,2013,2013-04-25,,,0,,0,human rights crimes are not relevant to this amnesty,0,0,0,1,1,1,0,0,0,"Le président Salva Kiir Mayardit a déclaré l'amnistie pour les chefs rebelles opérant dans les états de Jonglei, Unity et Upper Nile, ainsi que pour les combattants servant sous leurs ordres.",armed opposition,rank and file; leaders,armed opposition,,executive,11345,11978; 11805,South Sudan,2024-12-15
701,435,"President Maaouya Taya decreed a general amnesty for prisoners for crimes against state security, including those involved in the 1987 coup attempt",,1991,1991-03-09,,,0,Acceptance of the benefit from the general amnesty should be within a month from the date of the publication of this legal order. After this date the authorization mentioned above will no longer be in force,0,human rights crimes are not relevant to this amnesty,0,0,0,1,0,0,0,0,0,"Le président Maaouya Taya a décrété une amnistie générale pour les prisonniers ayant commis des crimes contre la sécurité de l'État, y compris ceux impliqués dans la tentative de coup d'État de 1987.",armed opposition,not specified,protesters / political prisoners; armed opposition,,executive,,,Mauritania,2024-12-15
498,373,"President Ilham Aliyev granted an amnesty to over 100 prisoners, including 53 opposition politicians",,2005,2005-06-20,,,0,,0,don't know,0,1,0,1,0,0,0,0,0,"Le président Ilham Aliyev a amnistié plus de 100 prisonniers, dont 53 hommes politiques de l'opposition.",dissent / political crimes; regular crime,rank and file; leaders,protesters / political prisoners; regular convicts,,executive,,,Azerbaijan,2024-12-15
863,483,President Idriss Deby granted a general amnesty to all activists and participants of the National Committee for the National Peace and Democracy,,1994,1994-11-12,,Non-state armed groups,0,,0,human rights crimes were included in amnesty,0,0,0,1,1,1,0,1,0,Le président Idriss Deby a accordé une amnistie générale à tous les militants et participants du Comité national pour la paix et la démocratie.,human rights violations; dissent / political crimes; armed opposition,,protesters / political prisoners; armed opposition,,legislative act,288,613,Chad,2024-12-15
1137,369,"Law No. 737-VII extended amnesty to protestors who participated in the Maidan protests between November 21, 2013, and February 2, 2014, for crimes including attempting a violent change of constitutional order, putting up resistance to a state official, threat of violence towards a state official",Law No. 737-VII,2014,2014-02-02,,,0,,0,human rights crimes are not relevant to this amnesty,0,1,0,1,1,1,0,0,0,"La loi n° 737-VII a étendu l'amnistie aux manifestants qui ont participé aux manifestations de Maidan entre le 21 novembre 2013 et le 2 février 2014, pour des crimes tels que la tentative de changement violent de l'ordre constitutionnel, la résistance à un représentant de l'État, la menace de violence à l'encontre d'un représentant de l'État.",dissent / political crimes,,protesters / political prisoners,,legislative act,13219,,Ukraine,2024-12-15
16,160,President Carlos Saúl Menem decreed an amnesty (Pardon No. 1003/89) for left-wing guerrillas awaiting trial for crimes committed during the 1970s,Pardon 1003/89. Pardon to people included in specific judicial proceedings,1989,1989-10-10,"President Menem released a series of pardons in 1989 in the name of national reconciliation and this is Pardon 1003/89 or also known as Decreto 1003. It was created on October 7, 1989 and covers several leaders and low-tier members of left-wing rebel groups, who were responsible for crimes committed during the 1970s. These members were held in detention awaiting trial for these crimes or fugitives in exile. Some of the left-wing guerrilla leaders, who were pardoned, were Fernando Vaca Narvaja and Roberto Perdía. The pardon also covers those who were listed as “wanted” in some court cases, but who were also known to have disappeared after their detention in the course of the “dirty war.” However, President Menem also stated that the pardon will not covered any “subversives,” who had been charged in court. Due to international pressure, the pardon also does not cover Mario Eduardo Firmenich, who was the former leader of the Montoneros. He was sentenced to 30 years in prison for the 1974 kidnapping of Juan and Jorge Born. At the same time, President Menem mentioned granting future pardoning of Firmenich.",,0,"The pardon will not covered any “subversives,” who had been charged in court.",0,human rights crimes were included in amnesty,0,1,0,1,1,1,0,0,0,Le président Carlos Saúl Menem décrète une amnistie (pardon n° 1003/89) pour les guérilleros de gauche en attente de jugement pour des crimes commis dans les années 1970.,human rights violations; dissent / political crimes; armed opposition,rank and file,armed opposition,,executive,247,502; 503,Argentina,2024-12-15
529,666,"The ""1995 Israeli-Palestinian Interim Agreement"" provided amnesty to Palestinian detainees, prisoners, and residents for security offences",The Israeli-Palestinian Interim Agreement on the West Bank and the Gaza Strip (Annex VII Release of Palestinian Prisonersand Detainees,1995,1995-09-28,,,0,- Required to sign a declaration that they will not commit terrorist activities.,0,human rights crimes were excluded from amnesty,0,0,0,1,1,1,0,0,0,"L'accord intérimaire israélo-palestinien de 1995 prévoit l'amnistie des détenus, prisonniers et résidents palestiniens ayant commis des infractions à la sécurité.",armed opposition,rank and file,protesters / political prisoners; armed opposition,,legislative act,234,,Israel,2024-12-15
703,435,"Law No. 023/93 provided amnesty to members of the security forces for violent acts committed to quell the opposition between January 1, 1989, and April 18, 1992",Loi Nº 023/93,1993,1993-06-14,,,0,,0,human rights crimes were included in amnesty,0,0,0,1,0,0,0,0,0,La loi n° 023/93 prévoit l'amnistie des membres des forces de sécurité pour les actes violents commis pour réprimer l'opposition entre le 1er janvier 1989 et le 18 avril 1992.,human rights violations; armed opposition,,state agents,high ranking,legislative act,,,Mauritania,2024-12-15
934,345,(Serbia and Montenegro) General Thorstein Skiaker grants amnesty to ethnic Albanian rebels in southern Serbia who surrender before May 24,,2001,2001-05-16,,,0,"- Albanian rebels in southern Serbia who surrender before 24 May 2001, when Yugoslav armed forces would be permitted to re-enter the area. - with the exception of persons suspected of having committed serious crimes, members of armed groups who lay down their weapons and cross that boundary will be released after a screening procedure",0,human rights crimes were excluded from amnesty,0,0,0,1,0,0,0,0,0,(Serbie et Monténégro) Le général Thorstein Skiaker amnistie les rebelles albanais du sud de la Serbie qui se rendent avant le 24 mai.,armed opposition,not specified,armed opposition,,executive,,,Serbia,2024-12-15
945,501,"The ""Truth, Justice and Reconciliation Commission Act"" provided an amnesty to all eligible applicants, except for genocide, crimes against humanity, and gross human rights violations",,2008,2008-11-28,,,0,"- within one month from the date of an announcement of amnesty by the Commission, or (b) such extended period as may be prescribed, submit such application to the Commission in the prescribed form - A criminal penalty attaches in respect of a matter on which amnesty has been requested under this Act the Commission shall not recommend amnesty in respect ... in respect of economic crimes, if the applicant has not made restitution.' - The applicant is required to fully disclose the relevant facts to the truth commission in order to benefit from the amnesty.",0,human rights crimes were included in amnesty,0,1,0,1,0,0,0,0,0,"La loi sur la commission vérité, justice et réconciliation (Truth, Justice and Reconciliation Commission Act) prévoit une amnistie pour tous les demandeurs éligibles, à l'exception des cas de génocide, de crimes contre l'humanité et de violations flagrantes des droits de la personne.",corruption or other economic crimes; human rights violations; dissent / political crimes; armed opposition,rank and file; leaders,state agents; armed opposition,high ranking; low ranking,legislative act,,,Kenya,2024-12-15
549,640,"Amnesty Law No. 1803 provided amnesty to political prisoners convicted of offences committed prior to February 7, 1974",Amnesty Law No. 1803,1974,1974-05-18,,,0,,0,don't know,0,1,0,0,0,0,0,0,0,La loi d'amnistie n° 1803 prévoit l'amnistie des prisonniers politiques condamnés pour des infractions commises avant le 7 février 1974.,dissent / political crimes; other,,protesters / political prisoners,,legislative act,,,Turkey,2024-12-15
284,840,"A peace agreement signed by the government includes an amnesty for 5,000 military officers and other who committed crimes against the state",General Agreement for Peace between the Government of the Republic of the Philippines and the Rebolusyonaryong Alyansang Makabansa - Soldiers of the Filipino People - Young Officers' Union,1995,1995-10-13,,,0,,0,human rights crimes are not relevant to this amnesty,0,1,0,1,1,0,1,1,0,Un accord de paix signé par le gouvernement prévoit une amnistie pour 5 000 officiers militaires et autres personnes ayant commis des crimes contre l'État.,armed opposition,not specified,state agents; armed opposition,high ranking,legislative act,308; 209,656; 411; 657; 658; 412,Philippines,2024-12-15
1086,811,"King Norodom Sihamoni decreed an amnesty for exiled opposition leader, Sam Rainsy",,2013,2013-07-12,This amnesty was requested by Prime Minister Hun Sen to show commitment towards a national unification and reconciliation. Sam Rainsy announced that he would return to CambodiaVietnam News Agency Bulletin,,0,,0,human rights crimes are not relevant to this amnesty,0,0,0,1,0,0,0,0,0,"Le roi Norodom Sihamoni a décrété une amnistie pour le chef de l'opposition en exil, Sam Rainsy.",dissent / political crimes,,refugees / exiles,,executive,,,Cambodia,2024-12-15
223,615,The government granted amnesty to members of armed Islamic groups who voluntarily surrendered,,2006,2006-03-04,,,0,,0,don't know,0,0,0,1,1,0,1,0,0,Le gouvernement a amnistié les membres des groupes islamiques armés qui se sont rendus volontairement.,armed opposition,rank and file,armed opposition,,executive,386,830,Algeria,2024-12-15
215,615,The government passed an amnesty for Mujahideen fighters and 90 political prisoners,,1981,1981-08-17,,,0,Mujahedeen fighters and 90 political prisoners,0,human rights crimes are not relevant to this amnesty,0,0,0,0,0,0,0,0,0,Le gouvernement adopte une amnistie pour les combattants moudjahidin et 90 prisonniers politiques.,dissent / political crimes; armed opposition,rank and file; leaders,protesters / political prisoners; armed opposition,,executive,,,Algeria,2024-12-15
432,651,The government granted an amnesty to former high-ranking government officials for various crimes against the government,,1974,1974-01-27,,,0,,0,don't know,0,0,0,0,0,0,0,0,0,Le gouvernement a accordé une amnistie à d'anciens hauts fonctionnaires pour divers crimes contre le gouvernement.,dissent / political crimes,,protesters / political prisoners,high ranking,executive,,,Egypt,2024-12-15
603,483,The government granted an amnesty to 24 political prisoners,,1992,1992-01-24,,political prisoners,0,,0,human rights crimes are not relevant to this amnesty,0,0,0,1,1,0,0,0,0,Le gouvernement a amnistié 24 prisonniers politiques.,dissent / political crimes,rank and file,protesters / political prisoners,,legislative act,,,Chad,2024-12-15
236,432,"President Moussa Traoré declared an amnesty for 25 political prisoners, including 13 involved in the November 1968 military coup",,1977,1977-01-01,,,0,,0,human rights crimes are not relevant to this amnesty,0,0,0,0,0,0,0,0,0,"Le président Moussa Traoré a déclaré une amnistie pour 25 prisonniers politiques, dont 13 impliqués dans le coup d'État militaire de novembre 1968.",armed opposition,not specified,armed opposition,,executive,,,Mali,2024-12-15
741,670,"King Khalid granted an amnesty to all political prisoners, including those involved in the 1969 coup attempt",,1975,1975-04-06,,,0,,0,human rights crimes are not relevant to this amnesty,0,0,0,0,0,0,0,0,0,"Le roi Khalid a amnistié tous les prisonniers politiques, y compris ceux qui ont participé à la tentative de coup d'État de 1969.",dissent / political crimes; armed opposition,not specified,protesters / political prisoners; armed opposition,,executive,,,Saudi Arabia,2024-12-15
393,625,"The government offered an amnesty to members of Marhal al-Sharqi movement, a Justice and Equality Movement (JEM) splinter group, who defected to the government",,2008,2008-01-14,,,0,,0,human rights crimes are not relevant to this amnesty,0,1,0,1,1,0,1,0,0,"Le gouvernement a offert une amnistie aux membres du mouvement Marhal al-Sharqi, un groupe dissident du Mouvement pour la justice et l'égalité (MJE), qui ont fait défection au profit du gouvernement.",armed opposition,,armed opposition,,executive,309,665,Sudan,2024-12-15
785,461,President Gnassingbé Eyadéma granted an amnesty to 11 prisoners for their roles in the coup attempt of September 1986,,1988,1988-01-13,,,0,,0,human rights crimes are not relevant to this amnesty,0,0,0,1,1,1,0,0,0,Le président Gnassingbé Eyadéma a amnistié 11 prisonniers pour leur rôle dans la tentative de coup d'État de septembre 1986.,dissent / political crimes; armed opposition,not specified,protesters / political prisoners; armed opposition,,executive,358,785,Togo,2024-12-15
20,339,"The ""Law On the Innocence and Amnesty of those formerly Convicted and Political Persecuted"" (Law No. 7516) provided amnesty to political prisoners and exiles, excluding opponents of the communist dictatorship, for crimes against the state","Law 'On the Innocence and Amnesty of those formerly Convicted and Politically Persecuted', No 7514",1991,1991-09-30,"Known as the Law “On the Innocence and Amnesty of those Formerly Convicted and Political Persecuted,” this amnesty law (No. 7516) was implemented on September 30, 1991 and later amended by law No. 7660 on January 14, 1993 and law No. 7719 on June 8, 1993. The Albanian government wanted to increase its public support by creating this amnesty law, which is for political prisoners. The amnesty specifically grants amnesty to those who were sentenced for running for power against the state, but not those who opposed the communist dictatorship. In other words, it grants amnesty to those who were in a leading opposing party or governmental role. Those not granted an amnesty are allowed to seek trial and prove their innocence to the court. The amnesty also covers Albanians who fled the country because of their political beliefs, affiliation, or activities during the war (Article 2). The amnesty law specifically spells out that those who gave out orders that led to “arrests, imprisonments, deportation, and displacement of families, due to the class struggle, and who have been active in using means to violence against the prisoners in the investigation office, prisons, camps, etc.” will not be granted amnesty (Mallinder Amnesty Law Database). Those who have been convicted or murder because of terrorist acts will also not be granted amnesty.",,0,"Excludes those who being in leading party and state posts have committed crimes against the state, because they have been sentenced in the course of running for power and not because they opposed the dictatorship.",0,human rights crimes are not relevant to this amnesty,0,1,1,0,0,0,0,0,0,"La ""loi sur l'innocence et l'amnistie des anciens condamnés et persécutés politiques"" (loi n° 7516) prévoit l'amnistie des prisonniers politiques et des exilés, à l'exclusion des opposants à la dictature communiste, pour les crimes commis contre l'État.",dissent / political crimes,,protesters / political prisoners,high ranking; not specified,legislative act,,,Albania,2024-12-15
28,95,"President Ernesto Pérez Balladares granted an amnesty to 222 people prosecuted after the fall of General Noriega, most of whom were former Noriega associates",Decreto Ejecutivo No. 469,1994,1994-09-23,"After taking office in September 1994 President Ernesto Pérez Balladares gave amnesties to 222 friends of former dictator, Noriega. The Vice-President (VP), Tomas Altamirano Duque also granted 130 pardons to other friends of Noreiga. The VP and others in the administration were known as “puppets” under Noreiga’s control so the pardons were essentially created for those who are loyal to Noreiga. This amnesty covers those who have been accused or convicted, but it does not cover members of the opposing political group.",,0,,0,don't know,0,1,1,1,0,0,0,0,0,"Le président Ernesto Pérez Balladares a amnistié 222 personnes poursuivies après la chute du général Noriega, dont la plupart étaient d'anciens collaborateurs de Noriega.",dissent / political crimes,not specified,state agents; protesters / political prisoners; armed opposition,not specified,executive,,,Panama,2024-12-15
968,770,"The Balochistan government declared an amnesty for all Baloch leaders, including activist Hyrbyair Marri and leader of the Baloch Republican Party, Brahumdagh Bugti",,2012,2012-02-23,,,0,,0,human rights crimes are not relevant to this amnesty,0,1,0,1,1,0,1,0,0,"Le gouvernement du Baloutchistan a déclaré une amnistie pour tous les dirigeants baloutches, y compris l'activiste Hyrbyair Marri et le dirigeant du parti républicain baloutche, Brahumdagh Bugti.",dissent / political crimes,rank and file; leaders,armed opposition,,executive,325,708; 709; 711,Pakistan,2024-12-15
155,850,"The government released 3,000 prisoners",,1979,1979-08-17,,,0,,0,human rights crimes are not relevant to this amnesty,0,0,0,1,0,0,0,0,0,Le gouvernement a libéré 3 000 prisonniers,dissent / political crimes,not specified,protesters / political prisoners; armed opposition,,,,,Indonesia,2024-12-15
110,315,(Czechoslovakia) The government passed an amnesty for minor criminals and citizens who had fled the country,,1973,1973-02-22,,,0,The citizens had until the end of 1973,0,human rights crimes are not relevant to this amnesty,0,0,0,0,0,0,0,0,0,(Tchécoslovaquie) Le gouvernement adopte une amnistie pour les petits criminels et les citoyens qui ont fui le pays.,dissent / political crimes; regular crime,not specified,regular convicts; refugees / exiles,,executive,,,Czechia,2024-12-15
369,516,"The National Assembly passed an amnesty to persons who committed crimes against the state prior to September 9, 1993",,1993,1993-09-19,,convicts,0,,0,human rights crimes were excluded from amnesty,0,0,0,1,1,1,0,0,0,L'Assemblée nationale a adopté une amnistie pour les personnes ayant commis des crimes contre l'État avant le 9 septembre 1993.,human rights violations; armed opposition,rank and file,protesters / political prisoners; armed opposition,,legislative act,287,593,Burundi,2024-12-15
78,371,"The government granted an amnesty to jailed activists for participating in the protests and riots in Yerevan from March 1 to 2, 2008",,2009,2009-06-19,,,0,,1,human rights crimes were excluded from amnesty,0,1,0,0,0,0,0,0,0,Le gouvernement a amnistié les militants emprisonnés pour avoir participé aux manifestations et aux émeutes qui ont eu lieu à Erevan les 1er et 2 mars 2008.,dissent / political crimes; regular crime,rank and file,protesters / political prisoners; regular convicts,,legislative act,,,Armenia,2024-12-15
740,403,"Parliament passed an amnesty for participants in the July 16, 2003 coup attempt and soldiers suspected of participating in other African conflicts",,2003,2003-07-24,,,0,,0,human rights crimes are not relevant to this amnesty,0,1,0,0,0,0,0,1,0,Le Parlement a adopté une amnistie pour les participants à la tentative de coup d'État du 16 juillet 2003 et les soldats soupçonnés d'avoir participé à d'autres conflits africains.,dissent / political crimes; armed opposition,not specified,armed opposition,,legislative act,,,Sao Tome and Principe,2024-12-15
561,670,The government offered an amnesty to Islamic insurgents,,2004,2004-06-23,"The purpose of this amnesty was to ""offer a chance for whoever belongs to the misguided group [al Qaeda] and is still at large following involvement in terrorism operations to repent, plead guilty and voluntarily surrender"" (NYTIMES). It seems as if the amnesty was targeted mainly toward new recruits of al Qaeda, rather than those who already had engaged in attacks. It was also not expected to cover leaders of al Qaeda responsible for killings. Crown Prince Abdullah said in a televised address, on behalf of King Fahd, that militants who turn themselves in will be treated fairly under God's law and spared the death penalty. But those who didn't will invoke the wrath of a government that derives its power from god. Mohsen al-Awaji, an Islamist lawyer who sought to mediate between the government and militants, said 'God's law"" meant those who gave themselves up would not face state prosecution but would be subject to civil charges. Prince Faisal said that ""the state will drop its claim on these criminals if they give themselves in, but the private claims of the families of those who were killed or who were assaulted or who were wounded will remain for them to decide"" (Mallinder).",,0,- time limit of one month - Must surrender voluntarily to security forces.,0,human rights crimes were included in amnesty,0,0,0,1,0,0,0,0,0,Le gouvernement a offert une amnistie aux insurgés islamiques.,terrorism; armed opposition,rank and file; leaders,armed opposition,,executive,,,Saudi Arabia,2024-12-15
335,640,"The ""Re-association Rehabilitation Law"" provided amnesty to members of the Kurdistan Workers' Party (PKK) and Islamic terrorist groups who surrendered, as well as to Turkish Kurdish refugees",Win-Back to Society Law,2003,2003-07-29,,,0,- The time limit on the amnesty law expired on 6 Feb 2004 (after a duration of six months). - Need to lay down weapons in exchange for no prison sentence (for those who had not been involved in violence) or less severe prison terms (for those involved in armed attacks).,0,human rights crimes were excluded from amnesty,0,1,0,1,1,0,1,0,0,"La ""loi de réhabilitation et de réassociation"" prévoit une amnistie pour les membres du Parti des travailleurs du Kurdistan (PKK) et des groupes terroristes islamiques qui se sont rendus, ainsi que pour les réfugiés kurdes turcs.",armed opposition,not specified,protesters / political prisoners; armed opposition; refugees / exiles,,,354,781,Turkey,2024-12-15
504,581,The government passed an amnesty for soldiers who supported the September 1992 coup,,1995,1995-10-04,,,0,,0,human rights crimes are not relevant to this amnesty,0,0,0,1,1,0,0,0,0,Le gouvernement a adopté une amnistie pour les soldats qui ont soutenu le coup d'État de septembre 1992,dissent / political crimes; armed opposition,not specified; leaders,protesters / political prisoners; armed opposition,,executive,362,789,Comoros,2024-12-15
512,438,"The government granted an amnesty to 300 political prisoners, many of whom were former high-ranking government officials",,1977,1977-12-01,,,0,,0,human rights crimes are not relevant to this amnesty,0,0,0,0,0,0,0,0,0,"Le gouvernement a amnistié 300 prisonniers politiques, dont beaucoup étaient d'anciens hauts fonctionnaires.",dissent / political crimes,not specified,state agents; protesters / political prisoners,high ranking,executive,,,Guinea,2024-12-15
