amnestyID,ccode_cow,mechanismDescription,amnestyName,amnestyYear,start_date,narrative,otherExplain,selfAmnesty,qualifyingProcess,blanket,hrCrimes,SGBV,startedDemocraticTransitionBefore,fitsPostAutocraticTJ,startedIntraConflbefore,fitsConflictTJ,pcj,dcj,peaceSettlement,mediation,mechanismDescription_fr,whatCrimes,oppRank,whoWasAmnestied,stateAgents,enactedHow,ucdpConflictID,ucdpDyadID,country,tjet_version
1098,530,"Parliament passed an amnesty for political prisoners who were under investigation or convicted of treason, crimes against the constitutional order, and armed struggle",,2018,2018-07-20,"""The law grants amnesty for individuals and groups either under investigation or convicted on treason, crime against the constitutional order and armed struggle"" This is part of Abiy's general effort to shake-up the status quo in a nation long criticised by rights groups for the brutality of its security forces, the jailing of dissidents and its narrow political space.",,0,,0,human rights crimes are not relevant to this amnesty,0,0,0,1,0,0,0,0,0,"Le Parlement a adopté une amnistie pour les prisonniers politiques qui faisaient l'objet d'une enquête ou qui avaient été condamnés pour trahison, crimes contre l'ordre constitutionnel et lutte armée.",dissent / political crimes,,protesters / political prisoners,,,,,Ethiopia,2024-12-15
933,530,President Mulatu Teshome granted an amnesty to former members of the Tigray People's Democratic Movement (TPDM),,2015,2015-10-26,,,0,,0,human rights crimes were excluded from amnesty,0,0,0,1,0,0,0,0,0,Le président Mulatu Teshome a accordé une amnistie aux anciens membres du Tigray People's Democratic Movement (TPDM).,dissent / political crimes; armed opposition,rank and file; leaders,protesters / political prisoners; armed opposition,,executive,,,Ethiopia,2024-12-15
95,434,The interim government granted amnesty to prisoners for their involvement in the coup plots of 1981 and 1988,,1990,1990-03-02,,,0,,0,human rights crimes are not relevant to this amnesty,0,1,1,0,0,0,0,0,0,Le gouvernement intérimaire a amnistié les prisonniers ayant participé aux coups d'État de 1981 et de 1988.,armed opposition,not specified,armed opposition,,legislative act,,,Benin,2024-12-15
917,490,"The government passed an amnesty for National Convention for the Republic (CNR) combatants, government forces, allied militias, and mercenaries for crimes committed since January 2000",,2002,,,,0,,0,human rights crimes were included in amnesty,0,0,0,1,1,1,0,0,0,"Le gouvernement a adopté une amnistie pour les combattants de la Convention nationale pour la République (CNR), les forces gouvernementales, les milices alliées et les mercenaires pour les crimes commis depuis janvier 2000.",human rights violations; dissent / political crimes; other; armed opposition,,state agents; armed opposition,,,283,586,Democratic Republic of the Congo,2024-12-15
373,317,"Prime Minister Meciar extended an amnesty to suspects in the kidnapping of Michal Kováč Jr., as well as officials who sabotaged the NATO referendum and presidential elections in May 1997",,1998,1998-03-04,,,0,,0,human rights crimes were included in amnesty,0,1,0,0,0,0,0,0,0,"Le Premier ministre Meciar accorde une amnistie aux suspects de l'enlèvement de Michal Kováč Jr, ainsi qu'aux fonctionnaires qui ont saboté le référendum sur l'OTAN et les élections présidentielles de mai 1997.",human rights violations; dissent / political crimes,,state agents,not specified,executive,,,Slovakia,2024-12-15
526,700,President Babrak Karmal decreed an amnesty for all political prisoners,,1980,1980-12-27,,,0,over 2000 political prisoners imprisoned by President Amin,0,don't know,0,0,0,1,0,0,0,0,0,Le président Babrak Karmal a décrété une amnistie pour tous les prisonniers politiques.,dissent / political crimes,not specified,protesters / political prisoners,,executive,,,Afghanistan,2024-12-15
294,436,The government granted an amnesty to all participants in the conflict between the Tuareg Armed Resistance Organization (ORA) and the Niger government,,1995,1995-06-12,,,0,,0,human rights crimes were included in amnesty,0,1,0,1,1,1,0,1,0,Le gouvernement a accordé une amnistie à tous les participants au conflit entre l'Organisation de résistance armée touareg (ORA) et le gouvernement nigérien.,human rights violations; armed opposition,not specified,state agents; armed opposition,not specified,legislative act,373,803,Niger,2024-12-15
528,615,"The ""Civil Harmony Law"" (Law No. 99­-08) provided amnesty to members of armed Islamic groups for all crimes committed, except for massacres, rape, and terrorism",The Civil Harmony Law (No. 99­08),1999,1999-07-13,,,0,"Must surrender voluntarily within six months of the promulgation of the law i.e. 13 Jan 2000 (art 3). Members of armed groups who surrendered after the expiry of the law on 13 Jan 2000 cannot benefit from reduced sentences or exemption from prosecution and are to be dealt with under the ordinary provisions of the permanent legislation. In Feb 2001, President Bouteflika suggested that the amnesty offer was still available even though deadlines specified in the law had passed. Must surrender voluntarily (art 41) to the military, civilian, administrative or judicial authorities. {2000 Presidential Decree} ?The persons who belonged to organizations which decided voluntarily and spontaneously to put an end to acts of violence and which put themselves at the full disposal of the state and whose names are appended to the original of this decree",0,human rights crimes were included in amnesty,0,0,0,1,1,0,1,0,0,"La ""loi sur l'harmonie civile"" (loi n° 99-08) amnistie les membres des groupes islamiques armés pour tous les crimes commis, à l'exception des massacres, des viols et du terrorisme.",human rights violations; armed opposition,rank and file,armed opposition,,executive; legislative act,386,828; 829,Algeria,2024-12-15
499,373,"President Ilham Aliyev decreed an amnesty for 114 prisoners, including several journalists",,2007,2007-12-28,,journalists,0,,0,don't know,0,1,0,1,0,0,0,0,0,"Le président Ilham Aliyev a décrété une amnistie pour 114 prisonniers, dont plusieurs journalistes.",dissent / political crimes; regular crime,rank and file,protesters / political prisoners; regular convicts,,executive,,,Azerbaijan,2024-12-15
409,615,The Politburo offered amnesty to individuals who fought against France in the War of Independence for political crimes,,1984,1984-11-01,,,0,,0,human rights crimes are not relevant to this amnesty,0,0,0,0,0,0,0,0,0,Le Politburo a offert l'amnistie aux personnes ayant combattu la France pendant la guerre d'indépendance pour des crimes politiques.,dissent / political crimes; armed opposition,rank and file,protesters / political prisoners,,executive,,,Algeria,2024-12-15
652,220,"Law No. 90-33 provided amnesty to insurgents for offences committed in relation to the establishment of the statute of New Caledonia before August 20, 1988",Loi No 90-33 du 10 janvier 1990 portant amnistie d'infractions commises à l'occasion d'événements survenues en Nouvelle-Calédonie,1990,1990-01-10,,,0,,0,human rights crimes are not relevant to this amnesty,0,0,0,1,0,0,0,0,0,La loi n° 90-33 a amnistié les insurgés pour les infractions commises en relation avec l'établissement du statut de la Nouvelle-Calédonie avant le 20 août 1988.,armed opposition,rank and file,armed opposition,,legislative act,,,France,2024-12-15
9,160,"The ""Law of National Pacification"" (Law No. 22,924) provided amnesty to all members of the armed forces for crimes against terrorist or subversive organizations between May 25, 1973, and June 17, 1982","Law 22,924 of National Pacification (Ley de Pacificacion Nacional)",1983,1983-09-23,"The Law of National Pacification, also known as Law No. 22.924 was passed on September 23, 1983 by the military regime. The military regime spent more than a year drafting up the law and its decree was delayed for several months due to disputes concerning its temporal and criminal jurisdictions. The legislation grants amnesty to military and government officials, who have committed political and related crimes. The regime used both television and radio outlets to advertise and endorse the amnesty. Opposition groups, trade unions, the Roman Catholic Church, and human rights NGOs opposed the amnesty. Although it pardoned military officials, many also opposed the amnesty because it gave the impression that they are responsible for or have actually committed crimes. On December 27, 1983, Congress repealed the amnesty legislation of the previous regime. Congress declared the amnesty law null and void. “This was possible because under a new conception of the validity of laws enacted by authoritarian governments, the law was treated as a de facto imposed norm which, as such, did not carry the presumption of validity enjoyed by norms of democratic origin. Therefore, it would be valid only if its content were just.” After just days of taking office, on December 10, 1983, President Alfonsín issued a decree that arrested high-ranking military officials for trial of the crimes they committed during the previous regime. The amnesty law covered all criminal activities related to or resulting from terrorist or subversive acts, but excludes members of illicit terrorist organizations. It only covers the period between June 17, 1982 (resignation of President Galtieri) and May 25, 1973 (return of the civilian government). June 1982 was a cut-off date to ensure that the then present military junta could not be held judicially accountable. This law also covers participants, instigators, accomplices, military and police members (Article 1). It even protests members of the paramilitary death squads, who kidnapped and killed hundreds of people under the approval of the military. The amnesty also covers international crimes, such as, crimes against humanity, stating: “'The penal actions arising from the crimes committed with terrorist or subversive motivation or objective between 25 May 1973 and 17 Jun 1982 shall be declared annulled. The benefits granted by this Law extend, in the same way, to all criminal activities resulting from or motivated by the development of actions directed at the avoidance, prevention or termination of the terrorist or subversive activities mentioned, whatever may have been their nature or the legal tenet violated” (Article 1). The amnesty excluded about 250 people, who had been charged with terrorist crimes by military and civilian courts. The amnesty also excluded economic crimes.",,1,"Excluded from the benefits provided in the preceding Article are members of illicit terrorist or subversive organisations who, on the date until which the benefits of the Law remain effective, do not reside legally and openly in the territory of the Argentine Nation or in places subject to its jurisdiction, or who have demonstrated by their conduct an intention to continue their connection with these organisations.",0,human rights crimes were included in amnesty,0,1,1,0,0,0,0,0,0,"La ""loi de pacification nationale"" (loi n° 22.924) amnistie tous les membres des forces armées pour les crimes commis contre des organisations terroristes ou subversives entre le 25 mai 1973 et le 17 juin 1982.",human rights violations; armed opposition,rank and file,state agents,high ranking; low ranking,executive,,,Argentina,2024-12-15
297,560,"President F. W. de Klerk provided amnesty to eight political prisoners, including Walter Sisulu, leader of the African National Congress",,1989,1989-10-15,,,0,,0,human rights crimes are not relevant to this amnesty,0,0,0,1,1,1,0,0,0,"Le président F. W. de Klerk a amnistié huit prisonniers politiques, dont Walter Sisulu, chef du Congrès national africain.",armed opposition,rank and file; leaders,protesters / political prisoners; armed opposition,,executive,345,766,South Africa,2024-12-15
138,553,"President Banda decreed an amnesty for all political prisoners, including exiles, for political crimes and security offences",,1993,1993-12-28,,,0,,0,human rights crimes are not relevant to this amnesty,0,0,0,0,0,0,0,0,0,"Le président Banda a décrété une amnistie pour tous les prisonniers politiques, y compris les exilés, pour les crimes politiques et les atteintes à la sécurité.",dissent / political crimes; armed opposition,rank and file,protesters / political prisoners; refugees / exiles,high ranking; low ranking,executive,,,Malawi,2024-12-15
678,645,"The Revolutionary Command Council granted amnesty to all political refugees abroad, including Iraqis involved in security incidents in Kurdistan",,1977,1977-12-08,,,0,,0,human rights crimes are not relevant to this amnesty,0,0,0,1,1,0,1,0,0,"Le Conseil du commandement de la révolution a amnistié tous les réfugiés politiques à l'étranger, y compris les Irakiens impliqués dans des incidents de sécurité au Kurdistan.",dissent / political crimes; armed opposition,rank and file,protesters / political prisoners; armed opposition,,executive,271,564; 565; 566,Iraq,2024-12-15
744,433,"The ""Cacheu Accords"" (Act No. 91-40) provided amnesty to Casamance separatists for all offences connected to the conflict",Act No. 91-40 (10 Jul 1991),1991,1991-07-10,,convicts,0,,0,human rights crimes are not relevant to this amnesty,0,0,0,1,1,1,0,1,0,"Les ""Accords de Cacheu"" (loi n° 91-40) ont amnistié les séparatistes casamançais pour tous les délits liés au conflit.",armed opposition,rank and file; leaders,armed opposition,,legislative act,375,806,Senegal,2024-12-15
447,666,"The government granted an amnesty to hundreds of Palestinian political prisoners, including a high-ranking Fatah commander",,1993,1993-10-19,,,0,,0,don't know,0,0,0,1,1,1,0,0,0,"Le gouvernement a amnistié des centaines de prisonniers politiques palestiniens, dont un haut commandant du Fatah.",armed opposition,not specified,protesters / political prisoners; armed opposition,,,234,476,Israel,2024-12-15
372,703,"The government declared an amnesty for those persecuted for political reasons, as well as those convicted for participating in or attempting a coup during the violent riots in Nookat on October 1, 2008",,2010,2010-04-27,,,0,,0,human rights crimes are not relevant to this amnesty,0,0,0,0,0,0,0,0,0,"Le gouvernement a déclaré une amnistie pour les personnes persécutées pour des raisons politiques, ainsi que pour les personnes condamnées pour avoir participé ou tenté un coup d'État lors des violentes émeutes qui ont eu lieu à Nookat le 1er octobre 2008.",dissent / political crimes,,protesters / political prisoners,,,,,Kyrgyzstan,2024-12-15
348,101,"President Hugo Chavez extended an amnesty to his political opponents for their involvement in the April 11, 2002 coup attempt and other plots to overthrow the government","Special Decree With The Hierarchy, Value and Force of Law on Amnesty No. 5 No. 5790",2007,2007-12-31,,,0,,0,human rights crimes were excluded from amnesty,0,0,0,1,0,0,0,0,0,Le président Hugo Chavez a amnistié ses opposants politiques pour leur participation à la tentative de coup d'État du 11 avril 2002 et à d'autres complots visant à renverser le gouvernement.,armed opposition,not specified,protesters / political prisoners; armed opposition,,executive,,,Venezuela,2024-12-15
649,220,"The government granted an amnesty for certain criminal offences committed before May 27, 1974",,1974,1974-07-10,,convicts,0,,0,human rights crimes were excluded from amnesty,0,0,0,1,0,0,0,0,0,Le gouvernement a accordé une amnistie pour certaines infractions pénales commises avant le 27 mai 1974.,dissent / political crimes,,protesters / political prisoners,,,,,France,2024-12-15
121,530,The government passed an amnesty for political prisoners and Eritrean rebels,,1976,1976-05-22,,,0,,0,human rights crimes are not relevant to this amnesty,0,0,0,1,1,0,1,0,0,Le gouvernement a adopté une amnistie pour les prisonniers politiques et les rebelles érythréens.,armed opposition,not specified,protesters / political prisoners; armed opposition,,,275,570; 571,Ethiopia,2024-12-15
42,70,"Congress passed an amnesty for approximately 250 rioters arrested during the October 2, 1968 demonstrations",,1976,1976-05-17,"On October 2, 1968 in the Plaza de las Tres Culturas in Mexico, military and police officers killed about 300 students. This event is considered to be a part of the Mexican Dirty War, in which the regime used repression tactics to quell political opposition. Out of about 3,000 people at the riot, more than 1,300 people were arrested. Although there were massive human rights violations, the amnesty only covers crimes related to the riots and rioters. Though there were about 1,300 people arrested, the amnesty law also only covers an estimated 250 individuals.","Civilians, not specified.",0,approximately 250 individuals who had been arrested during the student riots of October 1968.,0,human rights crimes are not relevant to this amnesty,0,0,0,0,0,0,0,0,0,Le Congrès a adopté une amnistie pour environ 250 émeutiers arrêtés lors des manifestations du 2 octobre 1968.,dissent / political crimes,,protesters / political prisoners,,legislative act,,,Mexico,2024-12-15
23,339,"Amnesty Law 8202 provided amnesty to civilian and military personnel for crimes committed during the January 10 to March 11, 1997 riots",Amnesty Law 8202,1997,1997-03-27,"Albania’s 1997 Amnesty Law 8202 is a modification of Amnesty Law No. 8198 and has some added provisions. It went to effect on March 27, 1997—the same month and year of No. 8198. This amnesty extends coverage to more crimes committed during the 1997 riots than the previous Law No. 8198. Article 1 lists a wide range of crimes not covered by this amnesty, including premeditated murder, sexual violence, kidnapping, prostitution, genocide, crimes against humanity, and torture with serious consequences. Article 2 states “[a]ll persons being criminally prosecuted or convicted for committing the crimes cited in Article 1 are to have their sentences reduced by a third if they voluntarily return to prison by 12.4.1997, while those sentenced to life imprisonment or death are to have their sentences reduced to 20 years’ imprisonment.” The Ministries of Justice, Interior, Defense, and Prosecutor General are all responsible for implementing this amnesty.",,0,"All persons being criminally prosecuted or convicted for committing the crimes cited in Article 1 are to have their sentences reduced by a third if they voluntarily return to prison by 12.4.1997, while those sentenced to life imprisonment or death are to have their sentences reduced to 20 years’ imprisonment.",0,human rights crimes were included in amnesty,1,1,1,0,0,0,0,0,0,La loi d'amnistie 8202 prévoit l'amnistie du personnel civil et militaire pour les crimes commis lors des émeutes du 10 janvier au 11 mars 1997.,dissent / political crimes; other,not specified,state agents; protesters / political prisoners,high ranking,legislative act,,,Albania,2024-12-15
570,700,The government granted amnesty to Taliban fighters in exile and rebel leader Pasha Khan Zadran for crimes against the government,2003 Amnesty,2003,2003-09-01,,,0,Taliban fighters seeking amnesty are required to hand in their arms. The rebels must accept the new constitution and the decrees of Karzai's government. Rank-and-file Taliban would be welcome to return home to reintegrate into society - provided they are not linked to Al-Qaeda or wanted for crimes against humanity.,0,human rights crimes were excluded from amnesty,0,0,0,1,1,0,1,0,0,Le gouvernement a amnistié les combattants talibans en exil et le chef rebelle Pasha Khan Zadran pour les crimes commis contre le gouvernement.,armed opposition,rank and file; leaders,armed opposition,,executive,333,735,Afghanistan,2024-12-15
363,660,Amnesty Law No. 84/91 provided a general amnesty to government agents for human rights violations and civilians for political crimes committed against state security during the civil war,General Amnesty Law No. 84/91,1991,1991-08-27,,,0,- Beneficiaries were prohibited from committing similar crimes and were sometimes investigated to ensure that they did not. The decree was subsequently lifted in relation to groups which continued to act violently (in accordance with the conditions of the law).,0,human rights crimes were included in amnesty,0,0,0,1,1,1,0,0,0,La loi d'amnistie n° 84/91 prévoit une amnistie générale pour les agents du gouvernement pour les violations des droits de la personne et pour les civils pour les crimes politiques commis contre la sécurité de l'État pendant la guerre civile.,human rights violations; armed opposition,rank and file; leaders,state agents; protesters / political prisoners; armed opposition,not specified,legislative act,260,527; 528; 529; 530; 531; 532; 533,Lebanon,2024-12-15
440,750,"The ""Mizoram Accord"" provided amnesty to 3,000 members of the Mizo National Army for insurgency","Mizoram Accord of 1986, Memorandum of Settlement",1986,1986-06-30,,,0,"Refers to an agreed time frame. Must surrender themselves and their arms, ammunitions and equipments",0,human rights crimes were included in amnesty,0,0,0,1,1,1,0,1,0,"L'""accord de Mizoram"" a amnistié 3 000 membres de l'armée nationale de Mizo pour insurrection.",human rights violations; armed opposition,not specified,armed opposition,,legislative act,296,638,India,2024-12-15
374,625,Major Hashem al-Atta granted an amnesty to 49 political prisoners,,1971,1971-07-20,,,0,,0,human rights crimes are not relevant to this amnesty,0,1,0,1,1,1,0,0,0,Le commandant Hashem al-Atta a amnistié 49 prisonniers politiques,dissent / political crimes,,protesters / political prisoners,,executive,309,661,Sudan,2024-12-15
493,652,Interior Minister Mohammad Harbah granted an amnesty to over 500 political prisoners,,1992,1992-04-10,,,0,,0,human rights crimes are not relevant to this amnesty,0,0,0,1,0,0,0,0,0,Le ministre de l'intérieur Mohammad Harbah a amnistié plus de 500 prisonniers politiques.,dissent / political crimes,,protesters / political prisoners,,executive,,,Syria,2024-12-15
56,93,The government extended a 1985 amnesty law for Contra rebels by one year,,1987,1987-07-10,"Ley de Amnistía General, Nº 36 repealed the 1987 amnesty law and was approved by the National Assembly on April 24, 1988 after the Constitutional Government of Nicaragua and the Nicaraguan Resistance agreed to the Sapoá Accords on March 23, 1988. This amnesty law pardons army personnel for crimes committed before July 19, 1979. Article 3 guaranteed that the Sandinista government would grant amnesty to the former regime’s army members, who were charged for rebellious crimes and to those who were charged with violating the law on order and security. The amnesty also applies to all Contra leaders and members, even those outside the country. The amnesty went through three phases of releasing political prisoners instead of releasing everyone immediately. First, 100 prisoners were released on Palm Sunday (March 27, 1988), then half of the remaining Contra prisoners were released on April 15 when the Contras moved to designated ceasefire zones, and then once the ceasefire agreement was finalized, the remaining prisoners were released. The amnesty law was extended until December 23, 1988 and again on September 3, 1989.",,0,,0,human rights crimes are not relevant to this amnesty,0,1,0,1,1,0,1,0,0,Le gouvernement a prolongé d'un an la loi d'amnistie de 1985 pour les rebelles de la Contra.,armed opposition,not specified,armed opposition,,legislative act,336,742,Nicaragua,2024-12-15
556,670,King Abdullah extended an amnesty to Islamic terrorists,,2006,2006-06-27,The purpose of this amnesty was similar to the one from 2004. It was meant to decrease al Qaeda's ranks.,,0,Must surrender to the police.,0,human rights crimes were included in amnesty,0,0,0,1,0,0,0,0,0,Le roi Abdallah a amnistié les terroristes islamiques.,terrorism; armed opposition,rank and file,armed opposition,,executive,,,Saudi Arabia,2024-12-15
15,93,"Amnesty Law No. 100 decreed a general amnesty to all Nicaraguans, for political and related offences committed between 1979 and 1990, including human rights violations and repression",Ley de amnistia (Ley No.100),1990,1990-05-23,"Not to be confused with Nicaragua 1990’s Law No. 81, this other 1990s amnesty is Law No. 100, which was a Presidential Decree approved by the National Assembly. It is also known as La Gaceta, N º 100, 23 May 1990, No. 98, p. 1064, which replaced Law No. 81 It was created on May 9, 1990. The legislation applies to “all those detained, prosecuted, sentenced, pending trial, still at large, and prisoners that have served out their sentence, as well as those who have been granted a simple pardon…” (Article 1). It also permits former Somoza guards and others to return back to their country. The amnesty also concerns those who were involved in political and related acts from before 1979 (the year of the dictator Somoza's downfall) to the present day.",,0,,0,human rights crimes were included in amnesty,0,1,1,1,0,0,0,0,0,"La loi d'amnistie n° 100 a décrété une amnistie générale pour tous les Nicaraguayens, pour les délits politiques et connexes commis entre 1979 et 1990, y compris les violations des droits de la personne et la répression.",human rights violations; armed opposition,,state agents; protesters / political prisoners; armed opposition,,legislative act,,,Nicaragua,2024-12-15
