vettingID,ccode_cow,invalid,alterationOf,policyName,dateLaw,narrative,yearStart,yearEnd,policySource,enactment,implemented,implementationNotes,courtChallenge,numberInvestigated,sources,startedDemocraticTransition,fitsPostAutocraticTJ,startedIntraConflBefore,fitsConflictTJ,beganDuringIntraConfl,beganAfterIntraConfl,type_dismissal,type_ban,type_declassification,type_perjury,policy_type,grp_exe,grp_legis,grp_judiciary,grp_public,grp_police,grp_military,grp_parties,grp_other,groups_targeted,inst_exe,inst_legis,inst_judiciary,inst_public,inst_police,inst_military,inst_parties,inst_other,inst_targeted,sum_inst,ban_from_elected,implementation,fairness,hearingsPublic,appealJudgment,var_fairness,policyName_fr,ucdpConflictID,ucdpDyadID,targetingWhy,policyProcedure,targetingAffiliationRank,targetingPositionSought,targetingAffiliation,targetingPositionsRank,sanctions,country,tjet_version
168,367,0,,Law on the Preservation and Use of Documents of the Former State Security Committee and the Determination of Individuals’ Collaboration with the KGB,1994-05-19,"Law required individuals to self-assess their degree of contact with the KGB to determine, inter alia, election eligibility. (Horne, Ch. 2)",1994,2014,Legislature/Parliament,legislative act,Yes (fully or partially),,,,Horne 2017 appendix,1,1,0,0,0,0,0,1,0,0,1,,,,,1,,,,1,,1,,1,,,,,2,2,1,1,,,,0,Loi sur la conservation et l'utilisation des documents de l'ancien Comité de sécurité de l'État et sur la détermination de la collaboration des individus avec le KGB,,,membership or affiliation with a certain group or organization,legislation,low; high,"public sector employee (bureaucrats, low-rank nominated or elected officials); legislature",police (includes ordinary police and secret police informants),,ban from future employment,Latvia,2024-08-20
88,255,0,,Attorney Screening Act,,This law banned people from practicing law who had engaged in human rights abuses or previously worked as an informer to the secret service.,1992,,Legislature/Parliament,legislative act,Yes (fully or partially),Evidence of uneven implementation of policy across the country (Blankenburg).,challenged in court with unclear outcome,,"""Gesetz zur Prüfung von Rechtsanwaltszulassungen, Notarbestellungen und Berufungen ehrenamtlicher Richter (The Attorney Screening Act), 1992. (Germany) "" Blankenburg, E. (1995). The Purge of Lawyers after the Breakdown of the East German Communist Regime. Law and Social Inquiry, 20(1), 223-243.",1,1,0,0,0,0,0,0,0,0,,,,,,,,,,,,,,,,,,,0,0,,,"Blankenberg raises questions around dual motivation after unification, referring to ""opportunistic strategies with regard to the future buildup thus mixed with the desires for revenge and justice toward those responsible for the communist past.""",public,yes,,Loi sur le filtrage des avocats,,,specific individual conduct,legislation,low,other,other,low,dismissal from current employment; ban from future employment,Germany,2024-08-20
151,368,0,51,1999 law on Declassification of former KGB collaborators / Law VIII-1436/1999 on the Registration and Acknowledgment (“Confession”) of Those Who Secretly Collaborated with the Soviet Special Services and Protection of Those Who Confessed,1999-11-23,"Law on confession by former KGB agents and collaborators and guarantee of protection for confession Through this law, lustration sought to “create a national security system, defending the state and its residents [and] protecting [them] from the influence of foreign secret service agencies”(Law VIII-1436). The revised 1999 lustration law—the Law on Registering and Confession (VIII-1436/1999) was passed in November 1999 and required former KGB collaborators to formally disclose collaboration within six months of the law’s publication (by June 8, 2000) to a five-member Lustration Commission (Republic of Lithuania 1999). The law explicitly granted the “right of the State to apply the principle of loyalty and trustworthiness to State officers and employees of State government and administration, local government…” as well as a host of related state and civil services (Article 1 §1 of Law VIII-1436/1999). The related semi-public and private sector positions included educational institutions, banks, “strategic businesses” (in communications), and private intelligence and security companies. The law also clarified the creation and functions of a Lustration Commission to facilitate the review of the lustration applications for evidence of collaboration (Pettai and Pettai 2014, 155). (Horne, 2017)",1999,2010,Legislature/Parliament,legislative act,Yes (fully or partially),"The Genocide and Resistance Research Center, the State Security Department, a parliamentary committee on national security and defense, and a lustration commission created by Law VIII-1436/1999 were charged with implementing lustration, considered a national security issue (Ravaitytė 2015) In ""phase one"" (voluntary confessions), ending in August 2000, approximately, 1589 Lithuanians registered themselves in a kind of self-lustration as former KGB operatives or persons who came into contact with the KGB. In the early 1990s, 800 individuals had “confessed” to a temporary commission to past collaboration; some of them “confessed” again in 2000. An estimated 25,000 people in independent Lithuania had collaborated with the KGB; one-tenth of them “confessed.” Employment restrictions were placed on eighty-seven people who worked for or collaborated with the KGB out of approximately 300 cases (RFE/RL 1999, November 18; RFE/RL 2000, August 8; RFE/RL 2000, August 16). In general, the number of compulsory employment changes was relatively small. During the second phase, compulsory disclosure and possible employment removal resulted for individuals who did not self-lustrate during phase one. In phase two, the work of the Lustration Commission was hampered by budget, staffing and political issues - very few cases were brought. In 2010 ,an amendment to Law VIII-1436 eliminated restrictions on former KGB agents working in the private sector. (Dovile and Budryte, p 8; Horne, 2017). This followed a series of ECtHR rulings that rejected the lustration of private sector positions but upheld the continued duty of the state to lustrate civil servants and public officials (ECtHR 2004; ECtHR 2005; ECtHR 2009).",court challenge modified the policy,,"Dovile and Burdyte, ""Lithuania"" ""Building Trust and Democracy: Transitional Justice in Post-Communist Countries"", Cynthia M. Horne formerly: ""About 50 Former KGB Employees Face Dismissal from Their Posts in Lithuania."" BBC Worldwide Monitoring 20 January 1999. Immigration and Refugee Board of Canada, Lithuania: Treatment of former KGB agents and the availability of state protection (Jan. 1998-Oct. 2002), 7 October 2002. Available at: http://www.refworld.org/docid/3f7d4dc623.html [accessed 3 July 2013] Kritz, Neil J. ""Lithuania."" Transitional Justice: How Emerging Democracies Reckon with Former Regimes: Volume II, Country Studies. Washington, DC: United States Institute of Peace, 1995: 763-769. Print. ""Law on Ex-KGB, Initiated by Landisbergis, Appealed in Lithuanian Constitutional Court."" Baltic News Service 6 October 1998. ""Lithuanian President Vetoes Work Restrictions for Ex KGB Staff, Says Constitutional Court Must be Consulted."" Baltic News Service 10 July 1998. ""Lithuanian Presidential Candidates Will Have to Report Their Collaboration with Foreign Secret Services."" Baltic News Service 14 October 1997. Nalepa, Monika. Skeletons in the Closet: Transitional Justice in Post-Communist Europe. New York: Cambridge University Press, 2010. Print. ""Parliament Limits Ex-KGB Officials' Right to Jobs."" Baltic New Service 1 July 1998. Ravaitytė, J. (2015). Evaluation of the Lustration Policy in Lithuania. Politologija, 77(1), 49-100.",0,0,0,0,0,0,1,1,1,0,3,,,,,1,,,,1,1,,1,1,1,,,1,2,5,0,1,"Doville and Budryte argue that the law proved difficult to implement, and that lustration has been uneven and driven by the politics of the ruling party over time. The Lustration Commission, mandated to identify and publicly release the names of former KGB operatives who refused to voluntarily confess their past, has struggled with an unpaid staff and lack of political support from leftist governments. Its decisions can be challenged in court .In some cases, the Commission obtained a case number that demonstrated collaboration with the KGB, but the courts deemed such evidence inconclusive. As a result, the Commission has publicized the names of few individuals. Horne (2017) argues that: regarding phase two, the Lustration Commission had tepid political support, lacked resources, and the staff was voluntary and unpaid (Anušauskas 2011). File access issues, data reliability problems, and high information hurdles to legally prove collaboration posed substantial burdens on the resource strapped Commission (Vėgelytė 2009). Moreover, they were tasked with implementing lustration cases against high-profile individuals in positions of power with significant financial resources (Vėgelytė 2009).29 All of this hindered the work of the Commission",public,yes,3,"Loi de 1999 sur la déclassification des anciens collaborateurs du KGB / Loi VIII-1436/1999 sur l'enregistrement et la reconnaissance (""confession"") des personnes ayant collaboré secrètement avec les services spéciaux soviétiques et sur la protection des personnes ayant fait des aveux",,,membership or affiliation with a certain group or organization,legislation,low; high,"public sector employee (bureaucrats, low-rank nominated or elected officials); police (includes ordinary police and secret police informants); executive; judiciary; other",police (includes ordinary police and secret police informants),low; high,dismissal from current employment; ban from future employment; declassification,Lithuania,2024-08-20
85,369,0,,Law about the Cleansing of Government [No. 1682-VII ―On Government Cleansing / “On Purification of Power”],2014-09-16,"Following the Euromaidan Revolution and the ensuing escape of notorious former Ukrainian President Yanukovych to Russia, Ukraine adopted the law to cleanse the central and local government of people who contributed to (1) power usurpation by Yanukovych, (2) undermining the foundations of Ukraine's national security and defense, and (3) violations of human rights and freedoms, including during the Euromaidan protests. Among the core demands of the revolution were to cleanse the government from corruption, nepotism, and various undemocratic practices, and the law aimed at delivering on those goals. To achieve those goals, the law aimed to lustrate people who held public service positions during the Yanukovych years and met substantive and temporal criteria established by the law, for example, the criteria of participating in unlawful and undemocratic practices during the Euromaidan protests or holding certain positions for at least one year during Yanukovych's reign. In addition, the law also targeted individuals who were affiliated with the Soviet Communist Party, Soviet security and intelligence services, individuals who violated assets declaration requirements under the Ukrainian anti-corruption legislation, and those who, by their actions, endangered Ukraine’s national security and territorial integrity, including via cooperation with foreign security services.",2014,,Legislature/Parliament,legislative act,Yes (fully or partially),"The performance of lustration measures takes place in two scenarios: (1) screening individuals who apply for positions in public service and (2) checking individuals who already occupy positions in public service. Under the first scenario, a person applying for a relevant public service position (but for the military personnel conscripted during the martial law) must submit a statement affirming that the lustration criteria apply or do not apply to them and agree to be subject to special screening procedure (background checks) and the publication of relevant information about it. If the screening establishes that the individual is subject to lustration measures, this constitutes a ground for refusing the individual’s application for the sought position. As to acting public officials, the process is more complicated and contains many aspects. The whole body of public officials is screened according to the law in the process coordinated by the Ministry of Justice of Ukraine but executed firsthand by responsible supervisors of respective state and municipal bodies where public officials work. In essence, the lustration process is decentralized, allowing state bodies to conduct lustration within and by themselves. The Ministry of Justice has access to details and information on how the process in each body is taking place and can recommend certain steps and publicly and privately highlight deficiencies of the process, but it lacks binding enforcement powers of its own under the Lustration Law. As required by the Lustration Law, the Ministry of Justice created the public council on lustration consisting of civil society’s representatives to exert public control over the lustration process, but it does not have any binding instruments to influence the process. The Cabinet of Ministers of Ukraine (government) confirms the schedule of screening procedures in different bodies proposed by the Ministry of Justice. Pursuant to this schedule, supervisors of relevant public officials in state and municipal bodies (who are authorized to discharge screened public officials) are responsible for conducting the screening, including sending requests for receiving relevant information from responsible public bodies. The supervisors perform the screening procedure based on the statements submitted by public officials, as described below. Namely, the persons occupying public positions must submit a statement to the responsible supervisors within ten days from the start of screening procedures at the relevant state or municipal body according to the schedule established by the Cabinet of Ministers of Ukraine (government). The statement must state whether the lustration criteria apply to the individual at hand and contain an agreement to be subject to special screening procedures (background checks) and to publish relevant information about the individual according to the Lustration Law. The statement in which an individual confirms that it is subject to lustration is a ground for this individual discharge from the occupied position and the application of the respective ban for occupying public positions in the future. As mentioned earlier, if the person does not submit the statement within the prescribed deadline, that is an independent ground for their discharge and the 10-year lustration ban, even if the person would not be subject to lustration otherwise. Every submitted statement goes via the background check process. If allegedly erroneous information is identified in those statements by controlling bodies, the screened person has a procedural opportunity to provide explanations and evidence in support of the information provided in the statement. The negative report based upon the background checks is a ground for discharge of the person and entering it into the public register of lustrated individuals. The screened individuals can challenge the substance of background check reports and their discharge from public service in court. Albeit the main text of the Lustration Law provides the screening procedure for acting officials based on the statements submitted by those officials within the scheduled screening mentioned earlier, the section of “final and transitional provisions” of the Lustration Law obliges the supervisors in state and municipal bodies to conduct the lustration measures based on personal files outside the scheduled process mentioned above but instead within ten days after the Lustration Law becomes effective. The information about the persons discharged from public service based on the Lustration Law is entered into the public register (administered by the Ministry of Justice) and becomes publicly available. As of 2020, the register of lustrated individuals reportedly contained around 900 former public officials discharged pursuant to the Lustration Law (the register is currently not accessible). However, in practice, individuals subject to lustration who quit public service voluntarily were not entered into the registry , and their numbers can be significant. The registry contains only individuals who did not quit independently and, in many cases, wanted to challenge their discharge in courts later on. The Ukrainian media reported that around 4 thousand former officials of the Yanukovych era felt indirect consequences of the law via the prohibition of being appointed to public positions. That said, there is no official public information on the total number of individuals directly and indirectly affected by the Lustration Law. Complaints of lustrated individuals and other stakeholders in courts Many individuals discharged under the Lustration Law filed complaints to Ukrainian courts of the administrative jurisdiction. Considering that cases on the Lustration Law touched novel and controversial constitutional issues, courts suspended their proceedings pending the constitutional review of the Lustration Law in the Constitutional Court of Ukraine. In 2014-2015, the Supreme Court of Ukraine and 47 members of the parliament from the opposition filed their separate petitions challenging the constitutionality of the Lustration Law to the Constitutional Court of Ukraine. The Constitutional Court conducted open hearings in 2016 but has yet to issue a decision to this date. Many lustrated officials submitted their complaints to the European Court of Human Rights (“Court”) on the violation of their human rights under the European Convention on Human Rights (“Convention”). In 2019, the Court issued its first decision in favor of five individuals lustrated under the Lustration Law finding the violation of their right to fair trial under Article 6 of the Convention (due to the prolonged suspension of the lustration cases pending the Constitutional Court’s review of the Lustration Law) and right to privacy under Article 8 of the Convention. Following the decision of the Court, the Ukrainian Supreme Court issued a decision in favor of a lustrated person (ordering the reinstatement of the person to the previously held position) based on the violation of the Convention with reasoning similar to that of the Court and despite the parallel constitutional review by the Constitutional Court. This decision ignited the spark of other cases ordering the reinstatement of lustrated individuals to their position in the state apparatus.",court challenge did not modify the policy,"~700,000 intended; > 86,730 by Oct 2016","The Law about the Cleansing of the Government, 2014 Tooshi, M. (2014, October 15). Ukraine's Lustration Law Attempts to Cleanse the Government of up to 1 Million Officials. Corporate Compliance Insights. Council of Europe Venice Commission (2015, June 19). Final Opinion on the Law on Government Cleansing (Lustration Law) of Ukraine. Ukraine's parliament passes law on lustration at third attempt. (2014, September 16). Kyiv Post. Shliaktun & Malkina 2020; David 2018; Horne 2018",1,0,1,0,0,0,1,1,0,0,2,1,,1,1,1,1,1,1,3,1,,1,1,1,1,,,2,5,0,1,"The European Commission for Democracy through Law (the “Venice Commission”), an expert advisory body of the Council of Europe on constitutional law matters, issued two opinions on the Lustration Law in 2014 and 2015, containing suggestions to improve and make the Lustration Law fully compliant with European standards. A number of prominent scholars, lawyers, and NGOs took the position that a law is not fair and constitutional, among other things, considering that it targeted a broad group of people without sufficient and immediate nexus to undemocratic practices. In Polyakh and others v. Ukraine (applications nos. 58812/15 and others, Judgment of 17 October 2019), the European Court of Human Rights found that the lustration of several individuals under the law violated those individuals' rights under the European Convention on Human Rights. Namely, the Court found that Ukraine violated the applicants' right to a fair trial within a reasonable time. This was so as the court proceedings based on their complaints lasted for more than four and a half years since the district court waited for the Constitutional Court to decide on whether the lustration measures were constitutional. In turn, the Constitutional Court’s proceedings were unjustifiably delayed. The Court also ruled on the violation of the applicants' right to privacy, considering that the nature and broad scope of lustration measures were disproportionate to the legitimate aim of preserving democracy. The Court mentioned the following factors in this regard: i. The application of the lustration law did not involve any individual assessment of the lustrated persons’ conduct, including their alleged commission of any specific acts to the detriment of democracy, the rule of law, national security, or human rights. ii. The state needed compelling reasons to use such a broad lustration scheme and to explain how merely being a public servant during the Yanukovych government for a certain time could signify a lack of loyalty to democratic principles. iii. The scheme was overbroad and not sufficiently narrowed down to the “pressing social need.” For example, several applicants were lustrated merely because they failed to resign from their posts one year after Yanukovych became the president. In this case, the triggering event of somebody taking office instead of some negative developments connected to individuals was not a justified criterion for dismissing career public servants. iv. The Court noted that the then-President of Ukraine, Petro Poroshenko, who signed the lustration law himself was a minister in the Yanukovych government for less than a year. In the Court’s opinion, that makes it hard to see how the goal of the lustration law could be achieved by removing far less important officials from public services. On a separate note, the Court had doubts about whether the law pursued the declared legitimate aims rather than the desire for retribution. Following the decision of the Court, the Ukrainian Supreme Court issued a decision in favor of a lustrated person (ordering the reinstatement of the person to the previously held position) based on the violation of the Convention with reasoning similar to that of the Court and despite the parallel constitutional review by the Constitutional Court. This decision ignited the spark of other cases ordering the reinstatement of lustrated individuals to their position in the state apparatus.",public,yes,3,"Loi sur l'épuration du gouvernement [N° 1682-VII - Sur l'épuration du gouvernement / ""Sur la purification du pouvoir""].",,,specific individual conduct; membership or affiliation with a certain group or organization,legislation,low; high,"public sector employee (bureaucrats, low-rank nominated or elected officials); police (includes ordinary police and secret police informants); executive; judiciary; armed forces","public sector employee (bureaucrats, low-rank nominated or elected officials); political parties; police (includes ordinary police and secret police informants); executive; judiciary; armed forces; other",low; high,dismissal from current employment; ban from future employment,Ukraine,2024-08-20
