vettingID,ccode_cow,invalid,alterationOf,policyName,dateLaw,narrative,yearStart,yearEnd,policySource,enactment,implemented,implementationNotes,courtChallenge,numberInvestigated,sources,startedDemocraticTransition,fitsPostAutocraticTJ,startedIntraConflBefore,fitsConflictTJ,beganDuringIntraConfl,beganAfterIntraConfl,type_dismissal,type_ban,type_declassification,type_perjury,policy_type,grp_exe,grp_legis,grp_judiciary,grp_public,grp_police,grp_military,grp_parties,grp_other,groups_targeted,inst_exe,inst_legis,inst_judiciary,inst_public,inst_police,inst_military,inst_parties,inst_other,inst_targeted,sum_inst,ban_from_elected,implementation,fairness,hearingsPublic,appealJudgment,var_fairness,policyName_fr,ucdpConflictID,ucdpDyadID,targetingWhy,policyProcedure,targetingAffiliationRank,targetingPositionSought,targetingAffiliation,targetingPositionsRank,sanctions,country,tjet_version
64,235,0,,Purge of military,,"Soon after the 25 April 1974 coup, the Armed Forces Movement (MFA)-who had carried out the coup-gave General Spinola a list of 60 generals who had remained loyal to the previous regime, and these generals were placed on reserve by Spinola's National Salvation Junta (JSN). Against Spinola's wishes, this purge expanded to affect more officers. Special military commissions were established to carry out the dismissals requested by the MFA. ""Collaboration with the old regime"" was the original criteria, but this was replaced with ""incompetence"" to make the purges easier to carry out. The MFA issued Decree Law 147C on 21 March 1975, calling for officers to be placed on reserve if they did not ""obey the principles espoused by the MFA."" These purges were mostly complete by 1976 (Pinto 2006, 182). Purged officers were ""deported"" (Pinto 2006, 179), ""removed from active duty,"" and ""placed on reserve"" (Pinto 2006, 182). This purge process also affected the National Republican Guard, a militarized police body (Pinto 2006, 182). I find no evidence of an appeals process or official challenges. Since it wasn't a written policy, I consider it fully implemented.",1974,1975,Executive,executive decree,Yes (fully or partially),The source states that most of the purge was done by 1976,don't know,,"Pinto, Antonio Costa. ""Authoritarian Legacies, Transitional Justice and State Crisis in Portugal’s Democratization."" Democratization 13:2 (April 2006): 173-204.",1,0,0,0,0,0,0,0,0,0,,,,,,,,,,,,,,,,,,,0,0,,,No data is available about the process made by the military commissions under the Decree Law,don't know,don't know,,Purge de l'armée,,,specific individual conduct; membership or affiliation with a certain group or organization,executive decree,low; high,police (includes ordinary police and secret police informants); armed forces,police (includes ordinary police and secret police informants); armed forces,low; high,dismissal from current employment,Portugal,2024-08-20
143,771,0,8,Banning of Pakistani forces and collaborators,,Revived in 2019 with legislated efforts to publish a formal list of collaborators.,2019,,,,,,,,,0,0,1,1,0,0,0,0,0,0,,,,,,,,,,,,,,,,,,,0,0,,,,,,,Interdiction des forces pakistanaises et des collaborateurs,,,,,,,,,,Bangladesh,2024-08-20
179,367,0,78,Amendment to 1994 Citizenship Law,2002,"Amendment to 1994 Citizenship Law to allow information from all secret service divisions to be used in the screening process, although lustration was again restricted in scope to top leaders, the highest courts, the Central Bank, the Ombudsman, the State Audit Office, the Prosecutor General’s office, and mayors or town with more than 10,000 residents. (Horne, 2007).",2002,,Legislature/Parliament,legislative act,Yes (fully or partially),,court challenge modified the policy,,"""Wezel, Katja. """"Latvia."""" Encyclopedia of Transitional Justice. Ed. Lavinia Stan and Nadya Nedelsky. New York: Cambridge University Press, 2013. 273-279. Print.""",1,1,0,0,0,0,1,1,0,0,2,,,,,,,,1,1,1,1,1,1,1,1,,,3,6,1,1,"One source describes two “non-democratic transitional justice elements” in Latvia. First, lustration was politicised and used as a political tool against ‘others. Russian minorities, even their descendants, have been unjustly punished by the tyranny of the majority. Second, there was a distrust of the democratisation by the Latvian intelligentsia. (Sairamby, pp. 136-137.)",public,don't know,2,Modification de la loi sur la citoyenneté de 1994,,,membership or affiliation with a certain group or organization,legislation,low; high,"public sector employee (bureaucrats, low-rank nominated or elected officials); police (includes ordinary police and secret police informants); legislature; executive; judiciary; armed forces",other,high,dismissal from current employment; ban from future employment,Latvia,2024-08-20
101,616,0,,Decree Laws 27 and 35,,"On 18 April 2011, the National Constituent Assembly of Tunis adopted Decree Law 27, which contained a prohibition of political participation for anyone who had held a function within the RCD during the past ten years or had called for the reelection of Ben Ali in 2014. Decree-Law 35 further introduced prohibitions that excluded former Constitutional Democratic Rally (party of the former president Ben Ali) officials from candidacy in elections. Article 15 of this decree excluded three categories of individuals: those who assumed positions in government under Ben Ali, with the exception of those who did not belong to the RCD; those who held positions of responsibility within the structures of the RCD; and those who called for Ben Ali’s reelection in 2014. Human Rights Watch commented that the mentioned laws amounted to the unnecessary and disproportionate restrictions on political rights.",2011,,Legislature/Parliament,constitutional act,Yes (fully or partially),,no court challenge,,"Christopher Lamont, ""Transitional Justice and the Politics of Lustration in Tunisia,"" The Middle East Institute, December 26, 2013.",1,1,1,0,0,0,0,0,0,0,,,,,,,,,,,,,,,,,,,0,0,,,"Yes, Human Rights Watch commented that the mentioned laws amounted to the unnecessary and disproportionate restrictions on political rights.",,,,Décrets-lois 27 et 35,,,specific individual conduct,legislation,low; high,legislature,political parties,high,ban from future employment,Tunisia,2024-08-20
86,316,0,,Act No. 140/1996 (Public Access to Files Connected to Activities of the Former Secret Police),1996-04-26,"On 26 April 1996, the Parliament of the Czech Republic passed Act. No. 140/1996 by legislation, allowing Czech citizens to access their secret police files.",1996,2002,Legislature/Parliament,legislative act,Yes (fully or partially),"The process has been described as “too expensive, too bureaucratic and inefficient” (Zacek, 2019)/",don't know,,"Priban, J. (2007). Oppressors and Their Victims: The Czech Lustration Law and the Rule of Law. In A. Mayer-Rieckh and P. de Greiff (Eds.), Justice as Prevention. Social Science Research Council.",1,1,0,0,0,0,0,0,1,0,1,,,,,1,,,,1,,,,,,,,,0,0,0,1,,don't know,don't know,0,Loi n° 140/1996 (accès du public aux dossiers relatifs aux activités de l'ancienne police secrète),,,membership or affiliation with a certain group or organization,legislation,,,police (includes ordinary police and secret police informants),don't know,declassification,Czechia,2024-08-20
130,290,0,62,"Amendments to 1997 Screening (""Lustration"") Law",,"In 2002-2003, a series of amendments were added to the law to weaken its effectiveness. Feb 15, 20002 amendment removed collaborators with military intelligence and counter intelligence. Sep 13 amendment limited the definition of collaboration",2002,2006,Legislature/Parliament,legislative act,Yes (fully or partially),,court challenge did not modify the policy,,"Ash, Timothy. ""Cleansing Poland of the 'red' poison; The Poles have made a complete mess of dealing with their Communist past."" The Globe and Mail (Canada), 25 May 2007. LexisNexis Academic. 22 June 2013 De, Greiff Pablo., and Alexander Mayer-Rieckh. Justice as prevention: Vetting public employees in transitional societies. New York: Social Science Research Council, 2007. Febbrajo, Alberto, and Wojciech Sadurski. Central and Eastern Europe after transition: Towards a new socio-legal semantics. Farnham: Ashgate Pub., 2010. Penketh, Anne. ""POLESAPART; The journey from communist state to 21st-century democracy has culminated in a dilemma for Poland: To purge the poison of he past or to forgive and forget . Anne Penketh reports from Krakow; Opening the files."" The Independent [London], 28 May 2007, First Edition ed. LexisNexis Academic. 22 June 2013 Scally, Derek. ""Poland's top court finds communist vetting law to be unconstitutional."" The Irish Times 11 May 2007: 11. LexisNexis Academic. 22 June 2013 Stan, Lavinia and Nadya Nedelsky. Encyclopedia of Transitional Justice Volume 2. New York: Cambridge University Press, 2013. Print. Millard 2021",1,1,0,0,0,0,0,0,1,1,2,,,,,1,,,,1,1,1,1,1,,,,,2,4,1,1,,public,don't know,2,"Modifications de la loi de 1997 sur le filtrage (""Lustration"")",,,membership or affiliation with a certain group or organization,legislation,low; high,"public sector employee (bureaucrats, low-rank nominated or elected officials); legislature; executive; judiciary",police (includes ordinary police and secret police informants),low; high,dismissal and ban upon lustration lie; declassification,Poland,2024-08-20
51,368,0,,Law No. I-2115 (Declassification of Deputies),1991-12-17,"In 1991, the Lithuanian parliament passed a law intended to prevent former employees and collaborators with the Soviet secret police and intelligence services (including, but not limited to, the KGB) from serving as parliamentary deputies. In 1992, the policy was expanded to cover all currently serving elected officials at the local and national level (Kritz 1995, 767-769). The law created a parliamentary committee charged with reviewing KGB records to identify deputies who were serving in the current government. These individuals were notified of their lustrated status and allowed to admit their collaboration or to appeal the committee's decision. Appeals of MPs went directly to the Lithuanian Supreme Court, while those of lower officials were handled by the courts of appeals. Those persons who admitted to past secret police association (or whose appeals were overruled) were subjected to a recall election. The ballot informed voters that the person was a known collaborator and asked whether or not his or her mandate should be renewed. In addition, the individual could resign at any point in the process. Thus, the only official sanction was declassification; however, it was expected that former collaborators would be forced out of government. A lustration committee was established and individuals were screened. Several high-profile cases, including the founder of one of the post-transition leftist parties, were lustrated (Kritz 1995, 767-769). However, implementation was problematic due to the KGB's partial success in removing or destroying files (Nalepa 2010, 201-2).",1991,1999,Legislature/Parliament,legislative act,Yes (fully or partially),"Horne (2017) says: lustration policies were effectively blocked when the author of the lustration bill was himself identified by the press as a former KGB agent, and the successor to the Lithuanian Communist Party won the 1992 parliamentary elections (Stan 2009, 231; RFE/RL 1998, June 29). As a result, despite the formal public disclosure rules and formal employment bans associated with lustration, they remained unimplemented in practice. However, Horne identifies that at least five prominent leaders were removed from office under the law.",don't know,,"""About 50 Former KGB Employees Face Dismissal from Their Posts in Lithuania."" BBC Worldwide Monitoring 20 January 1999. Immigration and Refugee Board of Canada, Lithuania: Treatment of former KGB agents and the availability of state protection (Jan. 1998-Oct. 2002), 7 October 2002. Available at: http://www.refworld.org/docid/3f7d4dc623.html [accessed 3 July 2013] Kritz, Neil J. ""Lithuania."" Transitional Justice: How Emerging Democracies Reckon with Former Regimes: Volume II, Country Studies. Washington, DC: United States Institute of Peace, 1995: 763-769. Print. ""Law on Ex-KGB, Initiated by Landisbergis, Appealed in Lithuanian Constitutional Court."" Baltic News Service 6 October 1998. ""Lithuanian President Vetoes Work Restrictions for Ex KGB Staff, Says Constitutional Court Must be Consulted."" Baltic News Service 10 July 1998. ""Lithuanian Presidential Candidates Will Have to Report Their Collaboration with Foreign Secret Services."" Baltic News Service 14 October 1997. Nalepa, Monika. Skeletons in the Closet: Transitional Justice in Post-Communist Europe. New York: Cambridge University Press, 2010. Print. ""Parliament Limits Ex-KGB Officials’ Right to Jobs."" Baltic New Service 1 July 1998.",1,0,0,0,0,0,0,0,1,1,3,,,,,1,,,,1,1,,,1,,,,,2,2,0,1,,don't know,yes,1,Loi n° I-2115 (Déclassification des députés),,,membership or affiliation with a certain group or organization,legislation,low; high,"public sector employee (bureaucrats, low-rank nominated or elected officials); executive",police (includes ordinary police and secret police informants),low; high,dismissal and ban upon lustration lie; declassification,Lithuania,2024-08-20
66,360,0,,Law No. 187,1999-12-09,"The Disclosure Law was enacted December 9, 1999 by the Romanian Parliament This law created the Council for the Study of the Securitate Archives to investigate past public officials and electoral candidates for collaboration with the Securitate through access to their secret files (Stan, 2009, pg 93). Without any true legal sanctions, this law acted as declassification for those exposed as collaborators. The Law is dubbed Ticu Law, after its initiator – former political detainee, Constantin Ticu Dumitrescu. The Law was launched with the purpose of sole disclosure of agents and collaborators of 'Securitate (secret police) as a political police'. In 2006 a Government Ordinance for the Modification and Completion of Law No 187/1999 on the Access to the Personal File and the Disclosure of the Securitate, as a Political Police (No 16 of 12 February 2006) was issued. The 1999 Disclosure Law became Law on the Access to Personal Files and the Disclosure of the Communist Political Police. The latest major development is the early 2008 decision of the Constitutional Court regarding the non-constitutional character of the Disclosure Law. Shortly afterwards, another Government Ordinance was issued, which regulates the activity of the institution that had so far managed the Disclosure drive in Romania. (""Forgiveness and Disclosure Scandals in Romania,"" Mica, 2008) This law proved meaningless as the Council for the Study of the Securitate Archives did not have access to the secret files. Therefore, this law was not implemented (Horne, 2011, pg 421). [Timo: I disagree with this]",1999,2008,Legislature/Parliament,legislative act,Yes (fully or partially),former (communist) secret police who continue to be employed by secret service are exempt for an additional 30 years all previous verdicts were invalidated by the Constitutional Court in Jan 2008,court challenge ended the policy,"~300,000","Ciocoiu, Paul. ""Romania gets lustration law, 20 years late."" SETimes.com. 1 June 2010. 22 June 2013 <http://www.setimes.com/cocoon/setimes/xhtml/en_GB/features/setimes/features/2010/06/01/feature-02>. ""Court Throws Out Lustration."" Presseurop. 8 June 2010. 22 June 2013 <http://www.presseurop.eu/en/content/news-brief/269151-court-throws- out-lustration-law>. Horne, Cynthia. ""Assessing the Impact of Lustration on Trust in Public Institutions and National Government in Central and Eastern Europe."" Comparative Political Studies 412-446 45 (2011): 421. <http://cps.sagepub.com/content/45/4/412.short>. Mica, Adriana.""Forgiveness and Disclosure Scandals in Romania."" Inter- Disciplinary.net. First Global Conference (2008). Session 5b: Forgiveness and Political Violence, Salzburg, Austria, Friday 7th March – Sunday 9th March 2008 Internet. 6/22/13. ""The Lustration law, unconstitutional: Collective sentences are forbidden."" Gandul.info. 8 June 2010. 22 June 2013 <http://www.gandul.info//english/the-lustration-law-unconstitutional-collective-sentences-are-forbidden-6326431>. ""Romanian law banning ex-communist officials from office unconstitutional."" BBC Monitoring Europe, 21 June 2010. LexisNexis Academic. 22 June 2013 ""Romanian parliament approves board set up to examine secret police archives."" BBC Monitoring Europe, 8 Mar. 2000. LexisNexis Academic. 22 June 2013 ""Romanian vetting body finds premier no Securitate collaborator."" BBC Monitoring Europe, 5 June 2006. LexisNexis Academic. 22 June 2013 Stan, Lavinia and Nadya Nedelsky. Encyclopedia of Transitional Justice Volume 2. New York: Cambridge University Press, 2013. Print. Stan, Lavinia. Transitional justice in Eastern Europe and the former Soviet Union: Reckoning with the Communist past. London: Routledge, 2008. Stan, Lavinia. Transitional Justice in Post-communist Romania: The Politics of Memory. Cambridge: Cambridge UP, 2013. Print. Stan 2019; Ciobanu 2014; Iancu 2010, 2021",1,1,1,0,0,0,0,0,1,0,1,,,,,1,,,,1,1,1,1,1,1,1,,,3,6,0,1,,secret,don't know,2,Loi n° 187,,,specific individual conduct; membership or affiliation with a certain group or organization,legislation,low; high,"public sector employee (bureaucrats, low-rank nominated or elected officials); police (includes ordinary police and secret police informants); legislature; executive; judiciary; armed forces",police (includes ordinary police and secret police informants),low; high,declassification,Romania,2024-08-20
42,645,0,,De-Baathification,,"On May 16 2003, the Coalition Provisional Authority established a de-Baathification policy through Order No. 1, ""De-Ba'athification of Iraqi Society,"" in order to purge public administration posts of senior party members of the Baath Party (Sissons and Al-Saiedi 2013, 11). On August 18 2003, the Iraqi Governing Council established the Higher National De-Baathification Commission (HNDC) to administer de-Baathification and expanded somewhat the scope of the policy: de-Baathification would now affect positions in state bureaucracy, politics, civil institutions, and the media, disqualifying those who had been party members from the level of Uda Ferqa or higher, senior-level civil servants, members of ""oppressive institutions,"" and those guilty of ""stealing national wealth, aggression, and other crimes"" (Sissons and Al-Saiedi 2013, 12). The HNDC also changed the appeals process, making the procedures less transparent (Sissons and Al-Saiedi 2013, 13). De-Baathification provisions were included in the 2005 Constitution, banning those targeted from positions in the Presidency Council, Prime Ministership, Parliament and their equivalents at the state level. Also in 2005, the HNDC began barring candidates from running for office and dismissing judges serving on the Iraqi High Tribunal (Sissons and Al-Saiedi 2013, 15). In 2006, the work of the HNDC began to focus more on reinstatement of banned persons (Sissons and Al-Saiedi 2013, 23). Reform measures were proposed in Parliament in 2007, and in 2008, the Accountability and Justice Law was passed, creating the Accountability and Justice Commission (AJC) to replace the HNDC and instituting some minimal reforms of the de-Baathification system. Some changes ""on paper"" included: most Ferqa-level members were allowed to return to government positions; an independent appeals body was created; a ""more aggressive stance"" was taken against those who had served in Baath intelligence agencies (Sissons and Al-Saiedi 2013, 18-19). The AJC got involved in the January 2010 elections, working to disqualify from candidacy former Baath Party members, former members of secret intelligence and security institutions, and those who had ""promoted"" the Baath Party (Sissons and Al-Saiedi 2013, 19-20).",2003,,Other,executive other,,,court challenge modified the policy,,"Sattar, Omar. ""Iraq's De-Baathification Controversy Still Lingers."" Al Hayat (Pan Arab). 14 January 2013. Retrieved at http://www.al-monitor.com/pulse/politics/2013/01/de-baathification-10-years.html Sissons, Miranda and Abdulrazzaq Al-Saiedi. ""A Bitter Legacy: Lessons of De-Baathification in Iraq."" International Center for Transitional Justice (March 2013). Retrieved at http://ictj.org/sites/default/files/ICTJ-Report-Iraq-De-Baathification-2013-ENG.pdf Williamson, John. ""Establishing Rule of Law in Post-War Iraq: Rebuilding the Justice System."" Georgia Journal of International and Comparative Law 33 (2004-2005): 229-244.",0,0,1,0,0,0,0,0,0,0,,,,,,,,,,,,,,,,,,,0,0,,,,public,yes,,Dé-baathification,,,membership or affiliation with a certain group or organization,other,low; high,,political parties,,dismissal from current employment; ban from future employment,Iraq,2024-08-20
96,790,0,,The Army Act,,"This law disqualified individuals from joining government services, army, or police who are convicted of human rights violations.",2006,,Legislature/Parliament,legislative act,Yes (fully or partially),,no court challenge,,Advocacy Forum-Nepal. (2014). Vetting in Nepal: Challenges and Issues.,1,1,1,1,0,1,0,0,0,0,,,,,,,,,,,,,,,,,,,0,0,,,,don't know,don't know,,La loi sur l'armée,269,562,specific individual conduct,legislation,low,"public sector employee (bureaucrats, low-rank nominated or elected officials); police (includes ordinary police and secret police informants); armed forces",police (includes ordinary police and secret police informants),low; high,ban from future employment,Nepal,2024-08-20
4,339,0,,"Law No 10034, dated December 22, 2008, The Law on the Cleanliness of the Character of High Functionaries of the Public Administration and Elected Person",2008-12-22,"On December 22 2008, Parliament adopted the ""Law on the Cleanliness of the Character of High Functionaries of the Public Administration and Elected Persons."" The law ""aimed at evaluating public officials' collaboration with the Sigurimi (secret police),"" which was responsible for numerous Communist-era violations. However, it was criticized upon its passage for its possible abuse as a political weapon (Austin 2013, 12). No specific information could be found regarding the law's sanctions, methods, or implementation. No information could be found regarding an appeals process. As of 2009, the law had been suspended by the Albanian Constitutional Court; Europe's Venice Commission reviewed the law and determined that it violated Albania's constitution, among other flaws (although the consequences of the Venice Commission's report are unclear) (Austin 2013, 12).",2008,2009,Legislature/Parliament,legislative act,No,The law was declared unconstitutional by the Venice Commission.,court challenge ended the policy,0,"Austin, Robert C. ""Albania."" Encyclopedia of Transitional Justice. Ed. Lavinia Stan and Nadya Nedelsky. New York: Cambridge University Press, 2013. 7-14. Print. Austin, Robert C. and Jonathan Ellison. ""Albania."" Transitional Justice in Eastern Europe and the Former Soviet Union: Reckoning with the Communist Past. Ed. Lavinia Stan. New York: Routledge, 2009. Print. Ballauri, Elsa and Kathleen Imholz. ""Country Overview: Albania."" Disclosing Hidden History: Lustration in the Western Balkans. Ed. Hatschikjan, Magarditsch, Dusan Reljic and Nenad Sebek. Thessaloniki: Center for Democracy and Reconciliation in Southeast Europe, 2005. Print. The text (translated to English) of laws 8001 and 8043, as well as the Constitutional Court’s ruling on the Socialist Party’s challenge, is available at http://www.lustration.net/albania_documentation.pdf.",1,1,0,0,0,0,1,1,0,0,2,,,,,1,,,,1,1,1,1,1,,,,,2,4,1,0,The law was condemned by international observers.,don't know,don't know,1,"Loi n° 10034 du 22 décembre 2008, Loi sur la propreté du caractère des hauts fonctionnaires de l'administration publique et des personnes élues.",,,membership or affiliation with a certain group or organization,legislation,don't know,"public sector employee (bureaucrats, low-rank nominated or elected officials); legislature; executive; judiciary",police (includes ordinary police and secret police informants),don't know,dismissal from current employment; ban from future employment,Albania,2024-08-20
